ID,Title,Category_English,category_arabic,Posted,Avg offer,Duration(Days),Number of Offers,Tags,Tags_en,Link
1,إعادة تصميم موقع باستخدام figma,Web Development,تطوير الويب,2025-05-01,200.00 ,10.0,24,"Figma, تصميم UI UX, فوتوشوب, تصميم موقع إلكتروني, إنشاء موقع إلكتروني, تطوير الويب, تصميم مواقع","Figma, design UI UX, photoshop, design web , create web , devweb, design web",https://mostaql.com/project/1080149-%D8%A5%D8%B9%D8%A7%D8%AF%D8%A9-%D8%AA%D8%B5%D9%85%D9%8A%D9%85-%D9%85%D9%88%D9%82%D8%B9-%D8%A8%D8%A7%D8%B3%D8%AA%D8%AE%D8%AF%D8%A7%D9%85-figma
2,مصمم ومطور واجهات Front-End لتطوير موقع قائم وإنشاء نموذج أولي على Figma,Web Development,تطوير الويب,2025-05-01,60.00 ,10.0,17,"تطوير البرمجيات, إدارة المواقع, برمجة, برمجة مواقع, بايثون, PHP, جافا سكريبت, HTML, CSS","application development ,  management web, programing, programing web, python, PHP, java script, HTML, CSS",https://mostaql.com/project/1080193-%D9%85%D8%B5%D9%85%D9%85-%D9%88%D9%85%D8%B7%D9%88%D8%B1-%D9%88%D8%A7%D8%AC%D9%87%D8%A7%D8%AA-front-end-%D9%84%D8%AA%D8%B7%D9%88%D9%8A%D8%B1-%D9%85%D9%88%D9%82%D8%B9-%D9%82%D8%A7%D8%A6%D9%85-%D9%88%D8%A5%D9%86%D8%B4%D8%A7%D8%A1-%D9%86%D9%85%D9%88%D8%B0%D8%AC-%D8%A3%D9%88%D9%84%D9%8A-%D8%B9%D9%84%D9%89-figma
3,سوق إلكتروني متخصص في بيع هدايا,Web Development,تطوير الويب,2025-05-01,"1,550.00 ",15.0,14,"تصميم متجر إلكتروني, إنشاء متجر إلكتروني, بايثون, PHP, CSS, جافا سكريبت, برمجة, تطوير البرمجيات, برمجة مواقع","design  online market, create  online market, python, PHP, CSS, java script, programing,  application development , programing web",https://mostaql.com/project/1080190-%D8%B3%D9%88%D9%82-%D8%A5%D9%84%D9%83%D8%AA%D8%B1%D9%88%D9%86%D9%8A-%D9%85%D8%AA%D8%AE%D8%B5%D8%B5-%D9%81%D9%8A-%D8%A8%D9%8A%D8%B9-%D9%87%D8%AF%D8%A7%D9%8A%D8%A7
4,استكمال تنصيب وتهيئة Odoo Community على مساحة كلاود لمشروع متعدد الشركات,Web Development,تطوير الويب,2025-05-01,500.00 ,5.0,3,"PostgreSQL, برمجة, تطوير البرمجيات, برمجة قواعد البيانات, أودو","PostgreSQL, programing,  application development , programing data base,  odoo",https://mostaql.com/project/1080213-%D8%A7%D8%B3%D8%AA%D9%83%D9%85%D8%A7%D9%84-%D8%AA%D9%86%D8%B5%D9%8A%D8%A8-%D9%88%D8%AA%D9%87%D9%8A%D8%A6%D8%A9-odoo-community-%D8%B9%D9%84%D9%89-%D9%85%D8%B3%D8%A7%D8%AD%D8%A9-%D9%83%D9%84%D8%A7%D9%88%D8%AF-%D9%84%D9%85%D8%B4%D8%B1%D9%88%D8%B9-%D9%85%D8%AA%D8%B9%D8%AF%D8%AF-%D8%A7%D9%84%D8%B4%D8%B1%D9%83%D8%A7%D8%AA
5,مشروع متعدد البائعين توصيل وتجارة إلكترونية وحجز سيارات,Web Development,تطوير الويب,2025-05-01,500.00 ,15.0,7,"تصميم موقع إلكتروني, برمجة أندرويد, برمجة iOS, برمجة, برمجة مواقع, برمجة التطبيقات, تطوير التطبيقات, إنشاء تطبيق, تطوير البرمجيات, هندسة البرمجيات","design web , programing android , programing iOS, programing, programing web, programing  apps , dev apps , create  application,  application development ,programming engineer",https://mostaql.com/project/1080085-%D9%85%D8%B4%D8%B1%D9%88%D8%B9-%D9%85%D8%AA%D8%B9%D8%AF%D8%AF-%D8%A7%D9%84%D8%A8%D8%A7%D8%A6%D8%B9%D9%8A%D9%86-%D8%AA%D9%88%D8%B5%D9%8A%D9%84-%D9%88%D8%AA%D8%AC%D8%A7%D8%B1%D8%A9-%D8%A5%D9%84%D9%83%D8%AA%D8%B1%D9%88%D9%86%D9%8A%D8%A9-%D9%88%D8%AD%D8%AC%D8%B2-%D8%B3%D9%8A%D8%A7%D8%B1%D8%A7%D8%AA
6,تصميم متجر لتركيب وبيع العطور يعتمد على الذكاء الاصطناعي,Web Development,تطوير الويب,2025-05-01,"1,000.00 ",60.0,8,"الذكاء الاصطناعي, تصميم موقع إلكتروني, إنشاء متجر إلكتروني, برمجة, تصميم متجر إلكتروني, برمجة مواقع, إنشاء موقع إلكتروني, هندسة البرمجيات, تطوير البرمجيات","AI, design web , create  online market, programing, design  online market, programing web, create web ,programming engineer,  application development",https://mostaql.com/project/1080098-%D8%AA%D8%B5%D9%85%D9%8A%D9%85-%D9%85%D8%AA%D8%AC%D8%B1-%D9%84%D8%AA%D8%B1%D9%83%D9%8A%D8%A8-%D9%88%D8%A8%D9%8A%D8%B9-%D8%A7%D9%84%D8%B9%D8%B7%D9%88%D8%B1-%D9%8A%D8%B9%D8%AA%D9%85%D8%AF-%D8%B9%D9%84%D9%89-%D8%A7%D9%84%D8%B0%D9%83%D8%A7%D8%A1-%D8%A7%D9%84%D8%A7%D8%B5%D8%B7%D9%86%D8%A7%D8%B9%D9%8A
7,برمجة تطبيق مزاد مباشر ومتجر الكتروني ومجموعة خدمات,Mobile Development,تطوير التطبيقات,2025-05-01,"1,500.00 ",30.0,9,"برمجة, تطوير البرمجيات, برمجة قواعد البيانات, برمجة مواقع, برمجة التطبيقات","programing,  application development , programing data base, programing web, programing  apps",https://mostaql.com/project/1080192-%D8%A8%D8%B1%D9%85%D8%AC%D8%A9-%D8%AA%D8%B7%D8%A8%D9%8A%D9%82-%D9%85%D8%B2%D8%A7%D8%AF-%D9%85%D8%A8%D8%A7%D8%B4%D8%B1-%D9%88%D9%85%D8%AA%D8%AC%D8%B1-%D8%A7%D9%84%D9%83%D8%AA%D8%B1%D9%88%D9%86%D9%8A-%D9%88%D9%85%D8%AC%D9%85%D9%88%D8%B9%D8%A9-%D8%AE%D8%AF%D9%85%D8%A7%D8%AA
8,إضافة إطار لجميع ملفات PDF الموجودة في Google Drive ورفع النتائج بنفس الترتيب والتنظيم,Software Engineering,هندسة البرمجيات,2025-05-01,50.00 ,3.0,8,"برمجة, برمجة مواقع, جافا سكريبت, تركيب سكربتات","programing, programing web, java script, scripting",https://mostaql.com/project/1080182-%D8%A5%D8%B6%D8%A7%D9%81%D8%A9-%D8%A5%D8%B7%D8%A7%D8%B1-%D9%84%D8%AC%D9%85%D9%8A%D8%B9-%D9%85%D9%84%D9%81%D8%A7%D8%AA-pdf-%D8%A7%D9%84%D9%85%D9%88%D8%AC%D9%88%D8%AF%D8%A9-%D9%81%D9%8A-google-drive-%D9%88%D8%B1%D9%81%D8%B9-%D8%A7%D9%84%D9%86%D8%AA%D8%A7%D8%A6%D8%AC-%D8%A8%D9%86%D9%81%D8%B3-%D8%A7%D9%84%D8%AA%D8%B1%D8%AA%D9%8A%D8%A8-%D9%88%D8%A7%D9%84%D8%AA%D9%86%D8%B8%D9%8A%D9%85
9,اختبار تقني شامل لتطبيق حجوزات نوادي مع كتابة الحالات الاختبارية التفصيلية,Web Development,تطوير الويب,2025-05-01,275.00 ,7.0,4,"استكشاف الأخطاء وإصلاحها, تصحيح برمجي, تطوير التطبيقات, اختبار تطبيقات الجوال, اختبار قابلية الاستخدام, اختبار الاختراق, اختبار البرمجيات",", debugging, dev apps , testing  application , testing  , testing , testing  programes",https://mostaql.com/project/1080107-%D8%A7%D8%AE%D8%AA%D8%A8%D8%A7%D8%B1-%D8%AA%D9%82%D9%86%D9%8A-%D8%B4%D8%A7%D9%85%D9%84-%D9%84%D8%AA%D8%B7%D8%A8%D9%8A%D9%82-%D8%AD%D8%AC%D9%88%D8%B2%D8%A7%D8%AA-%D9%86%D9%88%D8%A7%D8%AF%D9%8A-%D9%85%D8%B9-%D9%83%D8%AA%D8%A7%D8%A8%D8%A9-%D8%A7%D9%84%D8%AD%D8%A7%D9%84%D8%A7%D8%AA-%D8%A7%D9%84%D8%A7%D8%AE%D8%AA%D8%A8%D8%A7%D8%B1%D9%8A%D8%A9-%D8%A7%D9%84%D8%AA%D9%81%D8%B5%D9%8A%D9%84%D9%8A%D8%A9
10,مبرمج kotlin و laravel لتعديل على سورس كود لتطبيق تاكسي من موقع codecanyon,Web Development,تطوير الويب,2025-05-01,275.00 ,10.0,2,"برمجة, تطوير البرمجيات, برمجة قواعد البيانات, برمجة التطبيقات","programing,  application development , programing data base, programing  apps",https://mostaql.com/project/1080181-%D9%85%D8%A8%D8%B1%D9%85%D8%AC-kotlin-%D9%88-laravel-%D9%84%D8%AA%D8%B9%D8%AF%D9%8A%D9%84-%D8%B9%D9%84%D9%89-%D8%B3%D9%88%D8%B1%D8%B3-%D9%83%D9%88%D8%AF-%D9%84%D8%AA%D8%B7%D8%A8%D9%8A%D9%82-%D8%AA%D8%A7%D9%83%D8%B3%D9%8A-%D9%85%D9%86-%D9%85%D9%88%D9%82%D8%B9-codecanyon
11,إنشاء سكريبت لاستخراج بيانات,Web Development,تطوير الويب,2025-05-01,25.00 ,3.0,27,"بايثون, web scraping, استخراج البيانات, برمجة, تطوير البرمجيات, هندسة البرمجيات","python, web scraping,  data extraction , programing,  application development ,programming engineer",https://mostaql.com/project/1080148-%D8%A5%D9%86%D8%B4%D8%A7%D8%A1-%D8%B3%D9%83%D8%B1%D9%8A%D8%A8%D8%AA-%D9%84%D8%A7%D8%B3%D8%AA%D8%AE%D8%B1%D8%A7%D8%AC-%D8%A8%D9%8A%D8%A7%D9%86%D8%A7%D8%AA
12,نظام ERP يدعم عمليات البيع والشراء وإنشاء نظام عمولات للمسوقين,Software Engineering,هندسة البرمجيات,2025-05-01,237.50 ,30.0,6,"تخطيط موارد المؤسسات ERP, برمجة, برمجة تطبيقات سطح المكتب, هندسة البرمجيات, تطوير البرمجيات, تطوير التطبيقات","ERP ERP, programing, programing  application  ,programming engineer,  application development , dev apps",https://mostaql.com/project/1080147-%D9%86%D8%B8%D8%A7%D9%85-erp-%D9%8A%D8%AF%D8%B9%D9%85-%D8%B9%D9%85%D9%84%D9%8A%D8%A7%D8%AA-%D8%A7%D9%84%D8%A8%D9%8A%D8%B9-%D9%88%D8%A7%D9%84%D8%B4%D8%B1%D8%A7%D8%A1-%D9%88%D8%A5%D9%86%D8%B4%D8%A7%D8%A1-%D9%86%D8%B8%D8%A7%D9%85-%D8%B9%D9%85%D9%88%D9%84%D8%A7%D8%AA-%D9%84%D9%84%D9%85%D8%B3%D9%88%D9%82%D9%8A%D9%86
13,مشروع لعد الأشجار بالذكاء اصطناعي,Data Science,علم البيانات,2025-05-01,75.00 ,14.0,4,"برمجة, تطوير البرمجيات, برمجة قواعد البيانات","programing,  application development , programing data base",https://mostaql.com/project/1079973-%D9%85%D8%B4%D8%B1%D9%88%D8%B9-%D9%84%D8%B9%D8%AF-%D8%A7%D9%84%D8%A3%D8%B4%D8%AC%D8%A7%D8%B1-%D8%A8%D8%A7%D9%84%D8%B0%D9%83%D8%A7%D8%A1-%D8%A7%D8%B5%D8%B7%D9%86%D8%A7%D8%B9%D9%8A
14,مطور Backend لتنفيذ مشروع جاهز,Web Development,تطوير الويب,2025-05-01,73.00 ,6.0,18,"تطوير البرمجيات, إدارة المواقع, برمجة, برمجة مواقع, بايثون, PHP, جافا سكريبت, HTML, CSS","application development ,  management web, programing, programing web, python, PHP, java script, HTML, CSS",https://mostaql.com/project/1080034-%D9%85%D8%B7%D9%88%D8%B1-backend-%D9%84%D8%AA%D9%86%D9%81%D9%8A%D8%B0-%D9%85%D8%B4%D8%B1%D9%88%D8%B9-%D8%AC%D8%A7%D9%87%D8%B2
15,مصمم css لموقع في سلة,Web Development,تطوير الويب,2025-05-01,50.00 ,5.0,13,"تصميم جرافيك, برمجة, تطوير البرمجيات, برمجة قواعد البيانات, برمجة مواقع","design , programing,  application development , programing data base, programing web",https://mostaql.com/project/1080212-%D9%85%D8%B5%D9%85%D9%85-css-%D9%84%D9%85%D9%88%D9%82%D8%B9-%D9%81%D9%8A-%D8%B3%D9%84%D8%A9
16,عمل Dashboard لمتابعة سير أعمال المشروع,Networking,الشبكات,2025-05-01,50.00 ,1.0,2,"تصوير البيانات, تحليل البيانات, مايكروسوفت إكسل, Figma, Power BI, تصميم داش بورد",", data analysis,  Excel, Figma, Power BI, design",https://mostaql.com/project/1080249-%D8%B9%D9%85%D9%84-dashboard-%D9%84%D9%85%D8%AA%D8%A7%D8%A8%D8%B9%D8%A9-%D8%B3%D9%8A%D8%B1-%D8%A3%D8%B9%D9%85%D8%A7%D9%84-%D8%A7%D9%84%D9%85%D8%B4%D8%B1%D9%88%D8%B9
17,تصميم صفحة هبوط متجر,Software Engineering,هندسة البرمجيات,2025-05-01,199.00 ,1.0,16,"فوتوشوب, تصميم جرافيك, التصميم الإبداعي, تصميم إعلان, إنشاء صفحة هبوط, تصميم صفحات الهبوط, برمجة, برمجة مواقع","photoshop, design , design , design , create drop pages, design drop pages, programing, programing web",https://mostaql.com/project/1080043-%D8%AA%D8%B5%D9%85%D9%8A%D9%85-%D8%B5%D9%81%D8%AD%D8%A9-%D9%87%D8%A8%D9%88%D8%B7-%D9%85%D8%AA%D8%AC%D8%B1
18,تصميم موقع إلكتروني,Web Development,تطوير الويب,2025-05-01,100.00 ,10.0,14,"تصميم موقع إلكتروني, برمجة مواقع, إنشاء موقع إلكتروني, إنشاء موقع ووردبريس, ووردبريس, MySQL, بوتستراب, PHP, جافا سكريبت, CSS, HTML, التصميم الإبداعي, الفكرة التصميمية","design web , programing web, create web , create web wordpress, wordpress, MySQL, bootstrap, PHP, java script, CSS, HTML, design ,  design",https://mostaql.com/project/1080183-%D8%AA%D8%B5%D9%85%D9%8A%D9%85-%D9%85%D9%88%D9%82%D8%B9-%D8%A5%D9%84%D9%83%D8%AA%D8%B1%D9%88%D9%86%D9%8A
19,كتابة وتصميم مشروع محاسبي لشركة أغذية,Web Development,تطوير الويب,2025-05-01,250.00 ,10.0,3,"كتابة المحتوى, تصميم موقع إلكتروني, إنشاء موقع إلكتروني, تطوير الويب, التصميم الإبداعي, برمجة, هندسة البرمجيات",", design web , create web , devweb, design , programing,programming engineer",https://mostaql.com/project/1080252-%D9%83%D8%AA%D8%A7%D8%A8%D8%A9-%D9%88%D8%AA%D8%B5%D9%85%D9%8A%D9%85-%D9%85%D8%B4%D8%B1%D9%88%D8%B9-%D9%85%D8%AD%D8%A7%D8%B3%D8%A8%D9%8A-%D9%84%D8%B4%D8%B1%D9%83%D8%A9-%D8%A3%D8%BA%D8%B0%D9%8A%D8%A9
20,تصميم موقع احترافي متجاوب مع جميع الأجهزة,Web Development,تطوير الويب,2025-05-01,205.00 ,10.0,16,"برمجة, برمجة مواقع, إنشاء موقع إلكتروني, أمن وحماية المواقع, بايثون, PHP, CSS, جافا سكريبت","programing, programing web, create web ,   web, python, PHP, CSS, java script",https://mostaql.com/project/1080199-%D8%AA%D8%B5%D9%85%D9%8A%D9%85-%D9%85%D9%88%D9%82%D8%B9-%D8%A7%D8%AD%D8%AA%D8%B1%D8%A7%D9%81%D9%8A-%D9%85%D8%AA%D8%AC%D8%A7%D9%88%D8%A8-%D9%85%D8%B9-%D8%AC%D9%85%D9%8A%D8%B9-%D8%A7%D9%84%D8%A3%D8%AC%D9%87%D8%B2%D8%A9
21,بناء واجهات بفلاتر,Mobile Development,تطوير التطبيقات,2025-05-01,100.00 ,10.0,13,"flutter, Front End, برمجة, تطوير البرمجيات, برمجة مواقع, تصميم تطبيقات","flutter, Front End, programing,  application development , programing web, design  application",https://mostaql.com/project/1078844-%D8%A8%D9%86%D8%A7%D8%A1-%D9%88%D8%A7%D8%AC%D9%87%D8%A7%D8%AA-%D8%A8%D9%81%D9%84%D8%A7%D8%AA%D8%B1
22,حل مشكلةً عدم ظهور الصور في التطبيق ولوحة التحكم والخرائط,Web Development,تطوير الويب,2025-05-01,100.00 ,7.0,5,"برمجة مواقع, برمجة iOS, برمجة أندرويد, هندسة البرمجيات, تطوير التطبيقات, تطوير البرمجيات","programing web, programing iOS, programing android ,programming engineer, dev apps ,  application development",https://mostaql.com/project/1080184-%D8%AD%D9%84-%D9%85%D8%B4%D9%83%D9%84%D8%A9-%D8%B9%D8%AF%D9%85-%D8%B8%D9%87%D9%88%D8%B1-%D8%A7%D9%84%D8%B5%D9%88%D8%B1-%D9%81%D9%8A-%D8%A7%D9%84%D8%AA%D8%B7%D8%A8%D9%8A%D9%82-%D9%88%D9%84%D9%88%D8%AD%D8%A9-%D8%A7%D9%84%D8%AA%D8%AD%D9%83%D9%85-%D9%88%D8%A7%D9%84%D8%AE%D8%B1%D8%A7%D8%A6%D8%B7
23,تطبيق SCADA System لـ LS PLC,Mobile Development,تطوير التطبيقات,2025-05-01,250.00 ,3.0,1,"PLC, C# Programming, برمجة, تطوير البرمجيات, هندسة البرمجيات","PLC, C# Programming, programing,  application development ,programming engineer",https://mostaql.com/project/1080058-%D8%AA%D8%B7%D8%A8%D9%8A%D9%82-scada-system-%D9%84%D9%80-ls-plc
24,إنشاء بوت محلي (Desktop Bot) يعتمد على ChatGPT API للتحكم في الملفات,Cyber Security,الأمن السيبراني,2025-05-01,35.00 ,2.0,11,"تطوير البرمجيات, هندسة البرمجيات, اختبار البرمجيات, تعلم البرمجة, البرمجة الخطية, أنظمة مدمجة, برمجة, تصحيح برمجي, برمجة التطبيقات, برمجة مواقع","application development ,programming engineer, testing  programes ,  programing, programing ,  , programing, debugging, programing  apps , programing web",https://mostaql.com/project/1080119-%D8%A5%D9%86%D8%B4%D8%A7%D8%A1-%D8%A8%D9%88%D8%AA-%D9%85%D8%AD%D9%84%D9%8A-desktop-bot-%D9%8A%D8%B9%D8%AA%D9%85%D8%AF-%D8%B9%D9%84%D9%89-chatgpt-api-%D9%84%D9%84%D8%AA%D8%AD%D9%83%D9%85-%D9%81%D9%8A-%D8%A7%D9%84%D9%85%D9%84%D9%81%D8%A7%D8%AA
25,تعديل على تطبيق flutter ولوحة تحكم php,Mobile Development,تطوير التطبيقات,2025-05-01,118.00 ,7.0,1,"flutter, PHP, Back End, Front End, برمجة التطبيقات, برمجة iOS, برمجة أندرويد, برمجة تطبيقات أيفون, Dart","flutter, PHP, Back End, Front End, programing  apps , programing iOS, programing android , programing  application , Dart",https://mostaql.com/project/1080104-%D8%AA%D8%B9%D8%AF%D9%8A%D9%84-%D8%B9%D9%84%D9%89-%D8%AA%D8%B7%D8%A8%D9%8A%D9%82-flutter-%D9%88%D9%84%D9%88%D8%AD%D8%A9-%D8%AA%D8%AD%D9%83%D9%85-php
26,تعديل وتحسين متجر في سلة وإنشاء متجر جديد مع تفعيل قنوات الدفع تابي وتمارا,Web Development,تطوير الويب,2025-05-01,450.00 ,7.0,6,"تصميم متجر إلكتروني, التصميم الإبداعي, تصميم واجهة المستخدم, تصميم UI UX, تصميم تجربة المستخدم, adobe xd, Adobe Illustrator","design  online market, design , design UI, design UI UX, design UX, adobe xd, Adobe Illustrator",https://mostaql.com/project/1079988-%D8%AA%D8%B9%D8%AF%D9%8A%D9%84-%D9%88%D8%AA%D8%AD%D8%B3%D9%8A%D9%86-%D9%85%D8%AA%D8%AC%D8%B1-%D9%81%D9%8A-%D8%B3%D9%84%D8%A9-%D9%88%D8%A5%D9%86%D8%B4%D8%A7%D8%A1-%D9%85%D8%AA%D8%AC%D8%B1-%D8%AC%D8%AF%D9%8A%D8%AF-%D9%85%D8%B9-%D8%AA%D9%81%D8%B9%D9%8A%D9%84-%D9%82%D9%86%D9%88%D8%A7%D8%AA-%D8%A7%D9%84%D8%AF%D9%81%D8%B9-%D8%AA%D8%A7%D8%A8%D9%8A-%D9%88%D8%AA%D9%85%D8%A7%D8%B1%D8%A7
27,إختبار نظام,System Testing / QA,غير معروف,2025-05-01,50.00 ,3.0,8,"تصميم واجهة المستخدم, برمجة, Front End, Back End, تحسين محركات البحث, تحليل البيانات, C# Programming, جافا سكريبت","design UI, programing, Front End, Back End,   , data analysis, C# Programming, java script",https://mostaql.com/project/1079828-%D8%A5%D8%AE%D8%AA%D8%A8%D8%A7%D8%B1-%D9%86%D8%B8%D8%A7%D9%85
28,بناء نظام ساس,Web Development,تطوير الويب,2025-05-01,500.00 ,30.0,4,"لارافيل, Back End, برمجة مواقع, تصميم داش بورد, هندسة البرمجيات, تطوير البرمجيات, اختبار المواقع, تصميم UI UX, برمجة أندرويد","laravel, Back End, programing web, design  ,programming engineer,  application development , testing web, design UI UX, programing android",https://mostaql.com/project/1080001-%D8%A8%D9%86%D8%A7%D8%A1-%D9%86%D8%B8%D8%A7%D9%85-%D8%B3%D8%A7%D8%B3
29,تصميم متجر على شوبيفاي,Web Development,تطوير الويب,2025-05-01,100.00 ,3.0,7,"تصميم جرافيك, التصميم الإبداعي, تطوير البرمجيات, برمجة مواقع, شوبيفاي, قوالب شوبيفاي","design , design ,  application development , programing web, ,",https://mostaql.com/project/1079842-%D8%AA%D8%B5%D9%85%D9%8A%D9%85-%D9%85%D8%AA%D8%AC%D8%B1-%D8%B9%D9%84%D9%89-%D8%B4%D9%88%D8%A8%D9%8A%D9%81%D8%A7%D9%8A
30,تصميم وإنشاء موقع متخصص لخدمات رجال الأعمال والمستثمرين,Web Development,تطوير الويب,2025-04-30,"1,200.00 ",30.0,41,"التسويق عبر الإنترنت, تصميم موقع إلكتروني, برمجة مواقع, تطوير الويب, تصميم مواقع, خدمات الويب, تطوير الويب الكامل, إنشاء موقع إلكتروني",", design web , programing web, devweb, design web,  web, devweb, create web",https://mostaql.com/project/1079622-%D8%AA%D8%B5%D9%85%D9%8A%D9%85-%D9%88%D8%A5%D9%86%D8%B4%D8%A7%D8%A1-%D9%85%D9%88%D9%82%D8%B9-%D9%85%D8%AA%D8%AE%D8%B5%D8%B5-%D9%84%D8%AE%D8%AF%D9%85%D8%A7%D8%AA-%D8%B1%D8%AC%D8%A7%D9%84-%D8%A7%D9%84%D8%A3%D8%B9%D9%85%D8%A7%D9%84-%D9%88%D8%A7%D9%84%D9%85%D8%B3%D8%AA%D8%AB%D9%85%D8%B1%D9%8A%D9%86
31,مصمم واجهات أمامية ومبرمج باكند لموقع عمل حر,Web Development,تطوير الويب,2025-05-01,"1,100.00 ",60.0,24,"Back End, تصميم واجهة المستخدم, واجهة برمجة التطبيقات, React, React Native, Next.js, PHP, لارافيل","Back End, design UI,  programing  apps , React, React Native, Next.js, PHP, laravel",https://mostaql.com/project/1079736-%D9%85%D8%B5%D9%85%D9%85-%D9%88%D8%A7%D8%AC%D9%87%D8%A7%D8%AA-%D8%A3%D9%85%D8%A7%D9%85%D9%8A%D8%A9-%D9%88%D9%85%D8%A8%D8%B1%D9%85%D8%AC-%D8%A8%D8%A7%D9%83%D9%86%D8%AF-%D9%84%D9%85%D9%88%D9%82%D8%B9-%D8%B9%D9%85%D9%84-%D8%AD%D8%B1
32,إنشاء داش بورد تفاعلي,Data Science,علم البيانات,2025-05-01,30.00 ,3.0,48,"مايكروسوفت أوفيس, مايكروسوفت إكسل, تطوير البرمجيات, برمجة, برمجة قواعد البيانات",",  Excel,  application development , programing, programing data base",https://mostaql.com/project/1079843-%D8%A5%D9%86%D8%B4%D8%A7%D8%A1-%D8%AF%D8%A7%D8%B4-%D8%A8%D9%88%D8%B1%D8%AF-%D8%AA%D9%81%D8%A7%D8%B9%D9%84%D9%8A
33,مبرمج لارافل فيو جي اس لعمل لتعديل بموقع,Web Development,تطوير الويب,2025-05-01,30.00 ,1.0,10,"لارافيل, vuejs, PHP, جافا سكريبت, برمجة, تطوير البرمجيات, برمجة مواقع","laravel, vuejs, PHP, java script, programing,  application development , programing web",https://mostaql.com/project/1079977-%D9%85%D8%A8%D8%B1%D9%85%D8%AC-%D9%84%D8%A7%D8%B1%D8%A7%D9%81%D9%84-%D9%81%D9%8A%D9%88-%D8%AC%D9%8A-%D8%A7%D8%B3-%D9%84%D8%B9%D9%85%D9%84-%D9%84%D8%AA%D8%B9%D8%AF%D9%8A%D9%84-%D8%A8%D9%85%D9%88%D9%82%D8%B9
34,تطبيق جوال لفكرة مجتمعية بسيطة ومفيدة,Web Development,تطوير الويب,2025-04-30,"1,400.00 ",45.0,29,"برمجة, اللغة العربية, تصميم تجربة المستخدم, تصميم واجهة المستخدم, تصميم UI UX, تصميم تطبيقات الهواتف الذكية, تصميم تطبيقات, Swift, Ionic, كوتلن, جافا, برمجة iOS, برمجة التطبيقات, برمجة أندرويد","programing,  , design UX, design UI, design UI UX, design  application mobile, design  application, Swift, Ionic, kotlin, java, programing iOS, programing  apps , programing android",https://mostaql.com/project/1079762-%D8%AA%D8%B7%D8%A8%D9%8A%D9%82-%D8%AC%D9%88%D8%A7%D9%84-%D9%84%D9%81%D9%83%D8%B1%D8%A9-%D9%85%D8%AC%D8%AA%D9%85%D8%B9%D9%8A%D8%A9-%D8%A8%D8%B3%D9%8A%D8%B7%D8%A9-%D9%88%D9%85%D9%81%D9%8A%D8%AF%D8%A9
35,عمل تطبيق جوال لشركة هندسية,Web Development,تطوير الويب,2025-05-01,699.00 ,30.0,7,"تصميم مواقع, C# Programming, تصميم, تصميم تطبيقات, إنشاء متجر إلكتروني, برمجة التطبيقات, تطوير البرمجيات, برمجة, هندسة البرمجيات, برمجة iOS, برمجة أندرويد","design web, C# Programming, design, design  application, create  online market, programing  apps ,  application development , programing,programming engineer, programing iOS, programing android",https://mostaql.com/project/1079891-%D8%B9%D9%85%D9%84-%D8%AA%D8%B7%D8%A8%D9%8A%D9%82-%D8%AC%D9%88%D8%A7%D9%84-%D9%84%D8%B4%D8%B1%D9%83%D8%A9-%D9%87%D9%86%D8%AF%D8%B3%D9%8A%D8%A9
36,تصميم موقع إلكتروني,Web Development,تطوير الويب,2025-05-01,300.00 ,3.0,19,"تصميم موقع إلكتروني, برمجة مواقع, اللغة العربية, تصميم إعلان, اللغة الإنجليزية, الفكرة التصميمية","design web , programing web,  , design ,  ,  design",https://mostaql.com/project/1079993-%D8%AA%D8%B5%D9%85%D9%8A%D9%85-%D9%85%D9%88%D9%82%D8%B9-%D8%A5%D9%84%D9%83%D8%AA%D8%B1%D9%88%D9%86%D9%8A
37,تدريب نموذج ذكاء إصطناعي,Mobile Development,تطوير التطبيقات,2025-05-01,600.00 ,20.0,42,"الذكاء الاصطناعي, برمجة, برمجة مواقع, هندسة البرمجيات, التعلم الآلي","AI, programing, programing web,programming engineer,",https://mostaql.com/project/1080003-%D8%AA%D8%AF%D8%B1%D9%8A%D8%A8-%D9%86%D9%85%D9%88%D8%B0%D8%AC-%D8%B0%D9%83%D8%A7%D8%A1-%D8%A5%D8%B5%D8%B7%D9%86%D8%A7%D8%B9%D9%8A
38,تصميم موقع إلكتروني لشركة خدمات ووردبريس,Web Development,تطوير الويب,2025-05-01,100.00 ,10.0,29,"تصميم موقع إلكتروني, برمجة مواقع, أمن وحماية المواقع, بايثون, PHP, CSS, جافا سكريبت, ووردبريس, إنشاء موقع ووردبريس","design web , programing web,   web, python, PHP, CSS, java script, wordpress, create web wordpress",https://mostaql.com/project/1043059-%D8%AA%D8%B5%D9%85%D9%8A%D9%85-%D9%85%D9%88%D9%82%D8%B9-%D8%A5%D9%84%D9%83%D8%AA%D8%B1%D9%88%D9%86%D9%8A-%D9%84%D8%B4%D8%B1%D9%83%D8%A9-%D8%AE%D8%AF%D9%85%D8%A7%D8%AA-%D9%88%D9%88%D8%B1%D8%AF%D8%A8%D8%B1%D9%8A%D8%B3
39,تطوير متجر إلكتروني إحترافي باستخدام ووردبريس + ووكومرس,Web Development,تطوير الويب,2025-05-01,150.00 ,4.0,18,"برمجة مواقع, تصميم مواقع, تصميم UI UX, إنشاء موقع إلكتروني, ووكومرس, تصميم موقع إلكتروني, إنشاء موقع ووردبريس","programing web, design web, design UI UX, create web , , design web , create web wordpress",https://mostaql.com/project/1079926-%D8%AA%D8%B7%D9%88%D9%8A%D8%B1-%D9%85%D8%AA%D8%AC%D8%B1-%D8%A5%D9%84%D9%83%D8%AA%D8%B1%D9%88%D9%86%D9%8A-%D8%A5%D8%AD%D8%AA%D8%B1%D8%A7%D9%81%D9%8A-%D8%A8%D8%A7%D8%B3%D8%AA%D8%AE%D8%AF%D8%A7%D9%85-%D9%88%D9%88%D8%B1%D8%AF%D8%A8%D8%B1%D9%8A%D8%B3-%D9%88%D9%88%D9%83%D9%88%D9%85%D8%B1%D8%B3
