ID,Title,Category_English,category_arabic,Posted,Avg offer,Duration(Days),Number of Offers,Tags,Tags_en,Link
194,إنشاء متجر إلكتروني عربي، إنجليزي وبتكامل دفعات شامل,Web Development,تطوير الويب,2025-04-27,300.00 ,10.0,18,"اللغة العربية, التسويق عبر مواقع التواصل الاجتماعي, إدارة المتاجر الإلكترونية, تطوير البرمجيات, برمجة قواعد البيانات, برمجة مواقع, برمجة التطبيقات, برمجة, هندسة البرمجيات",",   web  ,  management  ,  application development , programing data base, programing web, programing  apps , programing,programming engineer",https://mostaql.com/project/1078232-%D8%A5%D9%86%D8%B4%D8%A7%D8%A1-%D9%85%D8%AA%D8%AC%D8%B1-%D8%A5%D9%84%D9%83%D8%AA%D8%B1%D9%88%D9%86%D9%8A-%D8%B9%D8%B1%D8%A8%D9%8A-%D8%A5%D9%86%D8%AC%D9%84%D9%8A%D8%B2%D9%8A-%D9%88%D8%A8%D8%AA%D9%83%D8%A7%D9%85%D9%84-%D8%AF%D9%81%D8%B9%D8%A7%D8%AA-%D8%B4%D8%A7%D9%85%D9%84
195,تصميم موقع إلكتروني تعريفي بمكتب تصميم داخلي,Web Development,تطوير الويب,2025-04-28,160.00 ,6.0,38,"تصميم تجربة المستخدم, تصميم واجهة المستخدم, التصميم الإبداعي, تصميم مواقع, تصميم موقع إلكتروني, برمجة مواقع, تطوير الويب, خدمات الويب","design UX, design UI, design , design web, design web , programing web, devweb,  web",https://mostaql.com/project/1078342-%D8%AA%D8%B5%D9%85%D9%8A%D9%85-%D9%85%D9%88%D9%82%D8%B9-%D8%A5%D9%84%D9%83%D8%AA%D8%B1%D9%88%D9%86%D9%8A-%D8%AA%D8%B9%D8%B1%D9%8A%D9%81%D9%8A-%D8%A8%D9%85%D9%83%D8%AA%D8%A8-%D8%AA%D8%B5%D9%85%D9%8A%D9%85-%D8%AF%D8%A7%D8%AE%D9%84%D9%8A
196,تطبيق توصيل طلبات,Mobile Development,تطوير التطبيقات,2025-04-27,250.00 ,10.0,4,"تصميم جرافيك, برمجة مواقع, برمجة التطبيقات, برمجة iOS, برمجة تطبيقات أيفون, برمجة أندرويد, برمجة قواعد البيانات, تطوير البرمجيات, واجهة برمجة التطبيقات, تصميم شعار","design , programing web, programing  apps , programing iOS, programing  application , programing android , programing data base,  application development ,  programing  apps , design",https://mostaql.com/project/1078175-%D8%AA%D8%B7%D8%A8%D9%8A%D9%82-%D8%AA%D9%88%D8%B5%D9%8A%D9%84-%D8%B7%D9%84%D8%A8%D8%A7%D8%AA
197,برمجة موقع ويب ولوحة تحكم أو تطبيق,Web Development,تطوير الويب,2025-04-27,450.00 ,10.0,8,"برمجة التطبيقات, برمجة مواقع, تطوير الويب, تصميم مواقع, برمجة iOS, برمجة قواعد البيانات, جافا, إنشاء موقع إلكتروني, هندسة البرمجيات, تصميم 3D","programing  apps , programing web, devweb, design web, programing iOS, programing data base, java, create web ,programming engineer, design 3D",https://mostaql.com/project/1078185-%D8%A8%D8%B1%D9%85%D8%AC%D8%A9-%D9%85%D9%88%D9%82%D8%B9-%D9%88%D9%8A%D8%A8-%D9%88%D9%84%D9%88%D8%AD%D8%A9-%D8%AA%D8%AD%D9%83%D9%85-%D8%A3%D9%88-%D8%AA%D8%B7%D8%A8%D9%8A%D9%82
198,مهندس برمجيات ومتخصص في ضمان الجودة,Data Science,علم البيانات,2025-04-27,100.00 ,5.0,1,"الذكاء الاصطناعي, برمجة, الهندسة, تطوير البرمجيات, هندسة البرمجيات","AI, programing,  engineering,  application development ,programming engineer",https://mostaql.com/project/1078063-%D9%85%D9%87%D9%86%D8%AF%D8%B3-%D8%A8%D8%B1%D9%85%D8%AC%D9%8A%D8%A7%D8%AA-%D9%88%D9%85%D8%AA%D8%AE%D8%B5%D8%B5-%D9%81%D9%8A-%D8%B6%D9%85%D8%A7%D9%86-%D8%A7%D9%84%D8%AC%D9%88%D8%AF%D8%A9
199,مبرمج مستقل للعمل على موديول لارافيل,Mobile Development,تطوير التطبيقات,2025-04-28,500.00 ,25.0,14,"برمجة, لارافيل, برمجة أندرويد, تطوير البرمجيات, برمجة قواعد البيانات, برمجة مواقع, برمجة التطبيقات, هندسة البرمجيات, flutter","programing, laravel, programing android ,  application development , programing data base, programing web, programing  apps ,programming engineer, flutter",https://mostaql.com/project/1078414-%D9%85%D8%A8%D8%B1%D9%85%D8%AC-%D9%85%D8%B3%D8%AA%D9%82%D9%84-%D9%84%D9%84%D8%B9%D9%85%D9%84-%D8%B9%D9%84%D9%89-%D9%85%D9%88%D8%AF%D9%8A%D9%88%D9%84-%D9%84%D8%A7%D8%B1%D8%A7%D9%81%D9%8A%D9%84
200,برمجة برنامج WhatsApp Sender,Mobile Development,تطوير التطبيقات,2025-04-28,75.00 ,5.0,9,"بايثون, برمجة, برمجة قواعد البيانات, تطوير البرمجيات, هندسة البرمجيات, إدارة قواعد البيانات, تطوير قاعدة بيانات","python, programing, programing data base,  application development ,programming engineer,  data base, dev",https://mostaql.com/project/1078376-%D8%A8%D8%B1%D9%85%D8%AC%D8%A9-%D8%A8%D8%B1%D9%86%D8%A7%D9%85%D8%AC-whatsapp-sender
201,مطور لتحويل موقع من ASP.NET إلى PHP,Web Development,تطوير الويب,2025-04-27,37.50 ,3.0,2,"تصميم موقع إلكتروني, HTML, ASP, MySQL, PHP, Paypal API, تطوير الويب","design web , HTML, ASP, MySQL, PHP, Paypal API, devweb",https://mostaql.com/project/1077721-%D9%85%D8%B7%D9%88%D8%B1-%D9%84%D8%AA%D8%AD%D9%88%D9%8A%D9%84-%D9%85%D9%88%D9%82%D8%B9-%D9%85%D9%86-aspnet-%D8%A5%D9%84%D9%89-php
202,تحويل تصميم xd الى responsive bootstrap,Web Development,تطوير الويب,2025-04-27,30.00 ,1.0,45,"تصميم موقع إلكتروني, تصميم مواقع, التصميم الإبداعي, تصميم واجهة المستخدم, تصميم تجربة المستخدم, تحويل تصميم من PSD إلى HTML, Front End","design web , design web, design , design UI, design UX,  design  PSD  HTML, Front End",https://mostaql.com/project/1077910-%D8%AA%D8%AD%D9%88%D9%8A%D9%84-%D8%AA%D8%B5%D9%85%D9%8A%D9%85-xd-%D8%A7%D9%84%D9%89-responsive-bootstrap
203,تطوير برنامج محاسبة او وصفحة ويب,Web Development,تطوير الويب,2025-04-27,800.00 ,30.0,10,"برمجة, تطوير البرمجيات, برمجة قواعد البيانات, برمجة مواقع, تخطيط موارد المؤسسات ERP, تطوير الويب, تصميم مواقع, خدمات الويب","programing,  application development , programing data base, programing web, ERP ERP, devweb, design web,  web",https://mostaql.com/project/1077739-%D8%AA%D8%B7%D9%88%D9%8A%D8%B1-%D8%A8%D8%B1%D9%86%D8%A7%D9%85%D8%AC-%D9%85%D8%AD%D8%A7%D8%B3%D8%A8%D8%A9-%D8%A7%D9%88-%D9%88%D8%B5%D9%81%D8%AD%D8%A9-%D9%88%D9%8A%D8%A8
204,تصميم وبرمجة تطبيق تقني مبني على الذكاء الإصطناعي,Web Development,تطوير الويب,2025-04-27,120.00 ,3.0,5,"الذكاء الاصطناعي, تصميم موقع إلكتروني, برمجة مواقع, أمن وحماية المواقع, بايثون, PHP, CSS, جافا سكريبت","AI, design web , programing web,   web, python, PHP, CSS, java script",https://mostaql.com/project/1077911-%D8%AA%D8%B5%D9%85%D9%8A%D9%85-%D9%88%D8%A8%D8%B1%D9%85%D8%AC%D8%A9-%D8%AA%D8%B7%D8%A8%D9%8A%D9%82-%D8%AA%D9%82%D9%86%D9%8A-%D9%85%D8%A8%D9%86%D9%8A-%D8%B9%D9%84%D9%89-%D8%A7%D9%84%D8%B0%D9%83%D8%A7%D8%A1-%D8%A7%D9%84%D8%A5%D8%B5%D8%B7%D9%86%D8%A7%D8%B9%D9%8A
205,إستكمال برمجة موقع ويب,Web Development,تطوير الويب,2025-04-27,100.00 ,14.0,36,"برمجة مواقع, تطوير الويب, تصميم مواقع, تطوير الويب الكامل, خدمات الويب, تصميم موقع إلكتروني, إنشاء موقع إلكتروني","programing web, devweb, design web, devweb,  web, design web , create web",https://mostaql.com/project/1077933-%D8%A5%D8%B3%D8%AA%D9%83%D9%85%D8%A7%D9%84-%D8%A8%D8%B1%D9%85%D8%AC%D8%A9-%D9%85%D9%88%D9%82%D8%B9-%D9%88%D9%8A%D8%A8
206,برنامج خدمات التنظيف المنزل,Software Engineering,هندسة البرمجيات,2025-04-27,365.00 ,10.0,14,"برمجة أندرويد, برمجة التطبيقات, برمجة iOS, جافا, كوتلن, Ionic, Swift, تصميم تطبيقات, تصميم تطبيقات الهواتف الذكية, تصميم UI UX, تصميم واجهة المستخدم, تصميم تجربة المستخدم","programing android , programing  apps , programing iOS, java, kotlin, Ionic, Swift, design  application, design  application mobile, design UI UX, design UI, design UX",https://mostaql.com/project/1077938-%D8%A8%D8%B1%D9%86%D8%A7%D9%85%D8%AC-%D8%AE%D8%AF%D9%85%D8%A7%D8%AA-%D8%A7%D9%84%D8%AA%D9%86%D8%B8%D9%8A%D9%81-%D8%A7%D9%84%D9%85%D9%86%D8%B2%D9%84
207,صفحة هبوط لبورتفوليو,Software Engineering,هندسة البرمجيات,2025-04-27,30.00 ,1.0,56,"تصميم صفحات الهبوط, إنشاء صفحة هبوط, تصميم تجربة المستخدم, تصميم موقع إلكتروني, إنشاء موقع إلكتروني, PHP, جافا سكريبت, HTML, CSS, html5, تصميم واجهة المستخدم, ووردبريس, مايكروسوفت وورد, إنشاء سيرة ذاتية","design drop pages, create drop pages, design UX, design web , create web , PHP, java script, HTML, CSS, html5, design UI, wordpress,  , create",https://mostaql.com/project/1077985-%D8%B5%D9%81%D8%AD%D8%A9-%D9%87%D8%A8%D9%88%D8%B7-%D9%84%D8%A8%D9%88%D8%B1%D8%AA%D9%81%D9%88%D9%84%D9%8A%D9%88
208,منصة بيع تذاكر,Web Development,تطوير الويب,2025-04-27,"7,500.00 ",45.0,16,"PHP, البحث والتطوير, إدارة المشاريع, تصميم موقع إلكتروني, اللغة الإنجليزية, التصميم الإبداعي, اللغة العربية, تصميم جرافيك","PHP,  ,  management , design web ,  , design ,  , design",https://mostaql.com/project/1077691-%D9%85%D9%86%D8%B5%D8%A9-%D8%A8%D9%8A%D8%B9-%D8%AA%D8%B0%D8%A7%D9%83%D8%B1
209,تطبيق أو موقع ويب لتحويل منتجات من 2D ل 3d,Web Development,تطوير الويب,2025-04-27,"1,250.00 ",60.0,4,"برمجة, برمجة مواقع, برمجة التطبيقات, الهندسة, تصميم 2d, تصميم 3D, تطوير البرمجيات, التعلم العميق","programing, programing web, programing  apps ,  engineering, design 2d, design 3D,  application development , deep learning",https://mostaql.com/project/1077943-%D8%AA%D8%B7%D8%A8%D9%8A%D9%82-%D8%A3%D9%88-%D9%85%D9%88%D9%82%D8%B9-%D9%88%D9%8A%D8%A8-%D9%84%D8%AA%D8%AD%D9%88%D9%8A%D9%84-%D9%85%D9%86%D8%AA%D8%AC%D8%A7%D8%AA-%D9%85%D9%86-2d-%D9%84-3d
210,تطوير سيرفر لغة دلفي (خبير تكامل أنظمة - System Integration Specialist).,Mobile Development,تطوير التطبيقات,2025-04-27,100.00 ,14.0,3,"برمجة, Delphi, خدمات الويب, مايكروسوفت إس كيو إل سيرفر, XML, MySQL, JSON, Restful API","programing, Delphi,  web,     , XML, MySQL, JSON, Restful API",https://mostaql.com/project/1077906-%D8%AA%D8%B7%D9%88%D9%8A%D8%B1-%D8%B3%D9%8A%D8%B1%D9%81%D8%B1-%D9%84%D8%BA%D8%A9-%D8%AF%D9%84%D9%81%D9%8A-%D8%AE%D8%A8%D9%8A%D8%B1-%D8%AA%D9%83%D8%A7%D9%85%D9%84-%D8%A3%D9%86%D8%B8%D9%85%D8%A9-system-integration-specialist
211,إنشاء متجر دروبشيبينغ احترافي ومبتكر يشمل كافة المزايا,Data Science,علم البيانات,2025-04-27,250.00 ,30.0,10,"تصميم متجر إلكتروني, التصميم الإبداعي, تصميمات سوشيال ميديا, التسويق الإلكتروني, إنشاء حملة إعلانية, تطوير البرمجيات, برمجة قواعد البيانات, برمجة, هندسة البرمجيات","design  online market, design , design  ,  , create  ,  application development , programing data base, programing,programming engineer",https://mostaql.com/project/1077994-%D8%A5%D9%86%D8%B4%D8%A7%D8%A1-%D9%85%D8%AA%D8%AC%D8%B1-%D8%AF%D8%B1%D9%88%D8%A8%D8%B4%D9%8A%D8%A8%D9%8A%D9%86%D8%BA-%D8%A7%D8%AD%D8%AA%D8%B1%D8%A7%D9%81%D9%8A-%D9%88%D9%85%D8%A8%D8%AA%D9%83%D8%B1-%D9%8A%D8%B4%D9%85%D9%84-%D9%83%D8%A7%D9%81%D8%A9-%D8%A7%D9%84%D9%85%D8%B2%D8%A7%D9%8A%D8%A7
212,تطوير موقع عقاري إحترافي متعدد اللغات باستخدام قالب WP Residence مع نظام موافقة يدوي للمستخدمين,Web Development,تطوير الويب,2025-04-27,550.00 ,30.0,9,"برمجة مواقع, تطوير الويب, خدمات الويب, تطوير الويب الكامل, تصميم مواقع, Front End, Back End, ووردبريس, إنشاء موقع ووردبريس, تصميم UI UX","programing web, devweb,  web, devweb, design web, Front End, Back End, wordpress, create web wordpress, design UI UX",https://mostaql.com/project/1077890-%D8%AA%D8%B7%D9%88%D9%8A%D8%B1-%D9%85%D9%88%D9%82%D8%B9-%D8%B9%D9%82%D8%A7%D8%B1%D9%8A-%D8%A5%D8%AD%D8%AA%D8%B1%D8%A7%D9%81%D9%8A-%D9%85%D8%AA%D8%B9%D8%AF%D8%AF-%D8%A7%D9%84%D9%84%D8%BA%D8%A7%D8%AA-%D8%A8%D8%A7%D8%B3%D8%AA%D8%AE%D8%AF%D8%A7%D9%85-%D9%82%D8%A7%D9%84%D8%A8-wp-residence-%D9%85%D8%B9-%D9%86%D8%B8%D8%A7%D9%85-%D9%85%D9%88%D8%A7%D9%81%D9%82%D8%A9-%D9%8A%D8%AF%D9%88%D9%8A-%D9%84%D9%84%D9%85%D8%B3%D8%AA%D8%AE%D8%AF%D9%85%D9%8A%D9%86
213,بناء موقع لمشروع مركز تدريبي,Web Development,تطوير الويب,2025-04-27,100.00 ,5.0,9,"تصميم موقع إلكتروني, تصميم الحقائب التدريبية, Front End, تطوير الويب, برمجة مواقع, تصميم مواقع, خدمات الويب","design web , design  , Front End, devweb, programing web, design web,  web",https://mostaql.com/project/1077916-%D8%A8%D9%86%D8%A7%D8%A1-%D9%85%D9%88%D9%82%D8%B9-%D9%84%D9%85%D8%B4%D8%B1%D9%88%D8%B9-%D9%85%D8%B1%D9%83%D8%B2-%D8%AA%D8%AF%D8%B1%D9%8A%D8%A8%D9%8A
214,منصة متخصصة لبيع البطاقات الرقمية,Mobile Development,تطوير التطبيقات,2025-04-27,800.00 ,15.0,9,"HTML, برمجة, CSS, برمجة iOS, برمجة أندرويد, هندسة البرمجيات, برمجة قواعد البيانات, برمجة مواقع, تطوير البرمجيات","HTML, programing, CSS, programing iOS, programing android ,programming engineer, programing data base, programing web,  application development",https://mostaql.com/project/1077998-%D9%85%D9%86%D8%B5%D8%A9-%D9%85%D8%AA%D8%AE%D8%B5%D8%B5%D8%A9-%D9%84%D8%A8%D9%8A%D8%B9-%D8%A7%D9%84%D8%A8%D8%B7%D8%A7%D9%82%D8%A7%D8%AA-%D8%A7%D9%84%D8%B1%D9%82%D9%85%D9%8A%D8%A9
215,تحسين واجهة موقع وورد بريس,Web Development,تطوير الويب,2025-04-27,100.00 ,5.0,8,"PHP, ووردبريس, فوتوشوب, تصميم جرافيك, التصميم الإبداعي, تصميم موقع إلكتروني","PHP, wordpress, photoshop, design , design , design web",https://mostaql.com/project/1077757-%D8%AA%D8%AD%D8%B3%D9%8A%D9%86-%D9%88%D8%A7%D8%AC%D9%87%D8%A9-%D9%85%D9%88%D9%82%D8%B9-%D9%88%D9%88%D8%B1%D8%AF-%D8%A8%D8%B1%D9%8A%D8%B3
216,تحويل فيجما إلى تطبيق إدارة متجر إلكتروني,Web Development,تطوير الويب,2025-04-27,400.00 ,20.0,19,"تصميم واجهة المستخدم, تصميم UI UX, تصميم تجربة المستخدم, التصميم الإبداعي, تصميم تطبيقات, تصميم تطبيقات الهواتف الذكية, adobe xd, flutter, React, React Native, برمجة أندرويد, برمجة iOS, Restful API","design UI, design UI UX, design UX, design , design  application, design  application mobile, adobe xd, flutter, React, React Native, programing android , programing iOS, Restful API",https://mostaql.com/project/1077953-%D8%AA%D8%AD%D9%88%D9%8A%D9%84-%D9%81%D9%8A%D8%AC%D9%85%D8%A7-%D8%A5%D9%84%D9%89-%D8%AA%D8%B7%D8%A8%D9%8A%D9%82-%D8%A5%D8%AF%D8%A7%D8%B1%D8%A9-%D9%85%D8%AA%D8%AC%D8%B1-%D8%A5%D9%84%D9%83%D8%AA%D8%B1%D9%88%D9%86%D9%8A
217,بناء بوابة تعليمية (معلمين وطلاب) على ووردبريس مع نظام دفع يدوي باللغة العربية,Web Development,تطوير الويب,2025-04-27,242.50 ,10.0,8,"HTML, CSS, جافا سكريبت, PHP, بوتستراب, MySQL, ووردبريس, إنشاء موقع ووردبريس, إنشاء موقع إلكتروني, برمجة مواقع, تصميم موقع إلكتروني","HTML, CSS, java script, PHP, bootstrap, MySQL, wordpress, create web wordpress, create web , programing web, design web",https://mostaql.com/project/1077801-%D8%A8%D9%86%D8%A7%D8%A1-%D8%A8%D9%88%D8%A7%D8%A8%D8%A9-%D8%AA%D8%B9%D9%84%D9%8A%D9%85%D9%8A%D8%A9-%D9%85%D8%B9%D9%84%D9%85%D9%8A%D9%86-%D9%88%D8%B7%D9%84%D8%A7%D8%A8-%D8%B9%D9%84%D9%89-%D9%88%D9%88%D8%B1%D8%AF%D8%A8%D8%B1%D9%8A%D8%B3-%D9%85%D8%B9-%D9%86%D8%B8%D8%A7%D9%85-%D8%AF%D9%81%D8%B9-%D9%8A%D8%AF%D9%88%D9%8A-%D8%A8%D8%A7%D9%84%D9%84%D8%BA%D8%A9-%D8%A7%D9%84%D8%B9%D8%B1%D8%A8%D9%8A%D8%A9
218,رفع تطبيق على جوجل بلاي و اب ستور,Mobile Development,تطوير التطبيقات,2025-04-27,50.00 ,4.0,3,"برمجة التطبيقات, اختبار تطبيقات الجوال, تطوير التطبيقات, إنشاء تطبيق, برمجة iOS, تصميم تطبيقات iOS, برمجة أندرويد","programing  apps , testing  application , dev apps , create  application, programing iOS, design  application iOS, programing android",https://mostaql.com/project/1077908-%D8%B1%D9%81%D8%B9-%D8%AA%D8%B7%D8%A8%D9%8A%D9%82-%D8%B9%D9%84%D9%89-%D8%AC%D9%88%D8%AC%D9%84-%D8%A8%D9%84%D8%A7%D9%8A-%D9%88-%D8%A7%D8%A8-%D8%B3%D8%AA%D9%88%D8%B1
219,خبير في google cloud,Cloud Computing,الحوسبة السحابية,2025-04-27,77.00 ,45.0,2,"استخراج البيانات, برمجة, JSON, الحوسبة السحابية, تطوير البرمجيات, هندسة البرمجيات, برمجة قواعد البيانات","data extraction , programing, JSON, cloud computing,  application development ,programming engineer, programing data base",https://mostaql.com/project/1077914-%D8%AE%D8%A8%D9%8A%D8%B1-%D9%81%D9%8A-google-cloud
220,بوت تليقرام للتنبيه عن عروض من مواقع,Web Development,تطوير الويب,2025-04-27,36.00 ,2.0,9,"تطوير التطبيقات, الذكاء الاصطناعي, هندسة البرمجيات, تطوير البرمجيات, برمجة التطبيقات, برمجة, الروبوتات","dev apps , AI,programming engineer,  application development , programing  apps , programing,",https://mostaql.com/project/1077836-%D8%A8%D9%88%D8%AA-%D8%AA%D9%84%D9%8A%D9%82%D8%B1%D8%A7%D9%85-%D9%84%D9%84%D8%AA%D9%86%D8%A8%D9%8A%D9%87-%D8%B9%D9%86-%D8%B9%D8%B1%D9%88%D8%B6-%D9%85%D9%86-%D9%85%D9%88%D8%A7%D9%82%D8%B9
221,برمجة تطبيق سحابي,Mobile Development,تطوير التطبيقات,2025-04-27,850.00 ,30.0,7,"تصميم متجر إلكتروني, إدارة المتاجر الإلكترونية, الحوسبة السحابية, برمجة التطبيقات, تطوير التطبيقات, إنشاء تطبيق","design  online market,  management  , cloud computing, programing  apps , dev apps , create  application",https://mostaql.com/project/1077979-%D8%A8%D8%B1%D9%85%D8%AC%D8%A9-%D8%AA%D8%B7%D8%A8%D9%8A%D9%82-%D8%B3%D8%AD%D8%A7%D8%A8%D9%8A
222,نحتاج مبرمج في اودو Community,Software Engineering,هندسة البرمجيات,2025-04-27,150.00 ,7.0,3,"برمجة, أودو","programing,  odoo",https://mostaql.com/project/1077776-%D9%86%D8%AD%D8%AA%D8%A7%D8%AC-%D9%85%D8%A8%D8%B1%D9%85%D8%AC-%D9%81%D9%8A-%D8%A7%D9%88%D8%AF%D9%88-community
223,تطبيق وموقع إلكتروني لوكلاء السفر ومنظمي الرحلات السياحية,Web Development,تطوير الويب,2025-04-27,"8,000.00 ",180.0,25,"جافا, إنشاء متجر إلكتروني, تصميم متجر إلكتروني, هندسة البرمجيات, التشفير, إنشاء تطبيق, HTML, جافا سكريبت","java, create  online market, design  online market,programming engineer, , create  application, HTML, java script",https://mostaql.com/project/1077903-%D8%AA%D8%B7%D8%A8%D9%8A%D9%82-%D9%88%D9%85%D9%88%D9%82%D8%B9-%D8%A5%D9%84%D9%83%D8%AA%D8%B1%D9%88%D9%86%D9%8A-%D9%84%D9%88%D9%83%D9%84%D8%A7%D8%A1-%D8%A7%D9%84%D8%B3%D9%81%D8%B1-%D9%88%D9%85%D9%86%D8%B8%D9%85%D9%8A-%D8%A7%D9%84%D8%B1%D8%AD%D9%84%D8%A7%D8%AA-%D8%A7%D9%84%D8%B3%D9%8A%D8%A7%D8%AD%D9%8A%D8%A9
224,تصميم ورفع تطبيق دردشة وألعاب على iOS و Android,Mobile Development,تطوير التطبيقات,2025-04-27,824.50 ,30.0,6,"تصميم تطبيقات, برمجة التطبيقات, flutter, برمجة ألعاب الجوال, تطوير الألعاب, تصميم ألعاب, تطوير التطبيقات, برمجة تطبيقات أيفون, برمجة أندرويد","design  application, programing  apps , flutter, programing  , dev, design , dev apps , programing  application , programing android",https://mostaql.com/project/1077803-%D8%AA%D8%B5%D9%85%D9%8A%D9%85-%D9%88%D8%B1%D9%81%D8%B9-%D8%AA%D8%B7%D8%A8%D9%8A%D9%82-%D8%AF%D8%B1%D8%AF%D8%B4%D8%A9-%D9%88%D8%A3%D9%84%D8%B9%D8%A7%D8%A8-%D8%B9%D9%84%D9%89-ios-%D9%88-android
225,ربط pts وATg وpos في برنامجي الحسابي مع جهاز الفواتير,Software Engineering,هندسة البرمجيات,2025-04-27,390.00 ,30.0,3,"برمجة, واجهة برمجة التطبيقات, هندسة البرمجيات, برمجة مواقع, تطوير الويب, خدمات الويب, Restful API","programing,  programing  apps ,programming engineer, programing web, devweb,  web, Restful API",https://mostaql.com/project/1077820-%D8%B1%D8%A8%D8%B7-pts-%D9%88atg-%D9%88pos-%D9%81%D9%8A-%D8%A8%D8%B1%D9%86%D8%A7%D9%85%D8%AC%D9%8A-%D8%A7%D9%84%D8%AD%D8%B3%D8%A7%D8%A8%D9%8A-%D9%85%D8%B9-%D8%AC%D9%87%D8%A7%D8%B2-%D8%A7%D9%84%D9%81%D9%88%D8%A7%D8%AA%D9%8A%D8%B1
226,إعادة إنتاج تصميم لتقريب 35 نافذة من صور موجودة لتطبيق جوال باستخدام Flutter Flow,Web Development,تطوير الويب,2025-04-26,250.00 ,15.0,5,"Figma, flutter, التصميم الإبداعي, فوتوشوب, برمجة قواعد البيانات, برمجة التطبيقات, برمجة iOS, برمجة تطبيقات أيفون, برمجة ألعاب الجوال, برمجة مواقع, برمجة, واجهة برمجة التطبيقات, برمجة أندرويد, البرمجة بطريقة MVC","Figma, flutter, design , photoshop, programing data base, programing  apps , programing iOS, programing  application , programing  , programing web, programing,  programing  apps , programing android , programing  MVC",https://mostaql.com/project/1077638-%D8%A5%D8%B9%D8%A7%D8%AF%D8%A9-%D8%A5%D9%86%D8%AA%D8%A7%D8%AC-%D8%AA%D8%B5%D9%85%D9%8A%D9%85-%D9%84%D8%AA%D9%82%D8%B1%D9%8A%D8%A8-35-%D9%86%D8%A7%D9%81%D8%B0%D8%A9-%D9%85%D9%86-%D8%B5%D9%88%D8%B1-%D9%85%D9%88%D8%AC%D9%88%D8%AF%D8%A9-%D9%84%D8%AA%D8%B7%D8%A8%D9%8A%D9%82-%D8%AC%D9%88%D8%A7%D9%84-%D8%A8%D8%A7%D8%B3%D8%AA%D8%AE%D8%AF%D8%A7%D9%85-flutter-flow
227,ربط سيرفرات مختلفة على دومين واحد,Web Development,تطوير الويب,2025-04-26,50.00 ,2.0,4,"الدعم الفني, الحوسبة السحابية, أمن وحماية المواقع, برمجة, برمجة مواقع",", cloud computing,   web, programing, programing web",https://mostaql.com/project/1077542-%D8%B1%D8%A8%D8%B7-%D8%B3%D9%8A%D8%B1%D9%81%D8%B1%D8%A7%D8%AA-%D9%85%D8%AE%D8%AA%D9%84%D9%81%D8%A9-%D8%B9%D9%84%D9%89-%D8%AF%D9%88%D9%85%D9%8A%D9%86-%D9%88%D8%A7%D8%AD%D8%AF
228,إنشاء مشروع متحرك على برنامج أدوبي أنميت,Software Engineering,هندسة البرمجيات,2025-04-26,100.00 ,5.0,1,"برمجة, برمجة قواعد البيانات, برمجة مواقع, برمجة التطبيقات, برمجة أندرويد, برمجة iOS, برمجة تطبيقات أيفون, برمجة ألعاب الجوال","programing, programing data base, programing web, programing  apps , programing android , programing iOS, programing  application , programing",https://mostaql.com/project/1077633-%D8%A5%D9%86%D8%B4%D8%A7%D8%A1-%D9%85%D8%B4%D8%B1%D9%88%D8%B9-%D9%85%D8%AA%D8%AD%D8%B1%D9%83-%D8%B9%D9%84%D9%89-%D8%A8%D8%B1%D9%86%D8%A7%D9%85%D8%AC-%D8%A3%D8%AF%D9%88%D8%A8%D9%8A-%D8%A3%D9%86%D9%85%D9%8A%D8%AA
229,برمجة نظام احترافي لإدارة مطاحن الذهب (نسخة كمبيوتر + تطبيق جوال),Mobile Development,تطوير التطبيقات,2025-04-26,875.00 ,30.0,12,"برمجة أندرويد, برمجة iOS, برمجة تطبيقات سطح المكتب, تطوير الويب, تصميم موقع إلكتروني, برمجة مواقع, بايثون, flutter, React Native, تصميم قواعد البيانات, الفكرة التصميمية, برمجة التطبيقات","programing android , programing iOS, programing  application  , devweb, design web , programing web, python, flutter, React Native, design data base,  design, programing  apps",https://mostaql.com/project/1077467-%D8%A8%D8%B1%D9%85%D8%AC%D8%A9-%D9%86%D8%B8%D8%A7%D9%85-%D8%A7%D8%AD%D8%AA%D8%B1%D8%A7%D9%81%D9%8A-%D9%84%D8%A5%D8%AF%D8%A7%D8%B1%D8%A9-%D9%85%D8%B7%D8%A7%D8%AD%D9%86-%D8%A7%D9%84%D8%B0%D9%87%D8%A8-%D9%86%D8%B3%D8%AE%D8%A9-%D9%83%D9%85%D8%A8%D9%8A%D9%88%D8%AA%D8%B1-%D8%AA%D8%B7%D8%A8%D9%8A%D9%82-%D8%AC%D9%88%D8%A7%D9%84
