ID,Title,Category_English,category_arabic,Posted,Avg offer,Duration(Days),Number of Offers,Tags,Tags_en,Link
383,عمل صيانة دورية ( كل إسبوعين / شهريا ) لموقع الشركة,Web Development,تطوير الويب,2025-04-23,60.00 ,1.0,24,"HTML, CSS, جافا سكريبت, PHP, بوتستراب, MySQL, تطوير الويب, برمجة مواقع, إدارة المواقع, تطوير البرمجيات, ووردبريس","HTML, CSS, java script, PHP, bootstrap, MySQL, devweb, programing web,  management web,  application development , wordpress",https://mostaql.com/project/1075804-%D8%B9%D9%85%D9%84-%D8%B5%D9%8A%D8%A7%D9%86%D8%A9-%D8%AF%D9%88%D8%B1%D9%8A%D8%A9-%D9%83%D9%84-%D8%A5%D8%B3%D8%A8%D9%88%D8%B9%D9%8A%D9%86-%D8%B4%D9%87%D8%B1%D9%8A%D8%A7-%D9%84%D9%85%D9%88%D9%82%D8%B9-%D8%A7%D9%84%D8%B4%D8%B1%D9%83%D8%A9
384,متخصص على دراية كاملة بمصطلح Farm installations,Mobile Development,تطوير التطبيقات,2025-04-23,100.00 ,3.0,1,"اختبار تطبيقات الجوال, تطوير البرمجيات, برمجة, برمجة قواعد البيانات, برمجة مواقع, برمجة التطبيقات, برمجة أندرويد, هندسة البرمجيات, برمجة iOS, flutter, برمجة تطبيقات أيفون","testing  application ,  application development , programing, programing data base, programing web, programing  apps , programing android ,programming engineer, programing iOS, flutter, programing  application",https://mostaql.com/project/1075812-%D9%85%D8%AA%D8%AE%D8%B5%D8%B5-%D8%B9%D9%84%D9%89-%D8%AF%D8%B1%D8%A7%D9%8A%D8%A9-%D9%83%D8%A7%D9%85%D9%84%D8%A9-%D8%A8%D9%85%D8%B5%D8%B7%D9%84%D8%AD-farm-installations
385,تصميم منصة تعليمية lms مرتبطة بنظام sis لإدارة معلومات الطالب,Software Engineering,هندسة البرمجيات,2025-04-23,200.00 ,10.0,5,"اللغة العربية, PHP, تصميم موقع إلكتروني, برمجة, تطوير البرمجيات",", PHP, design web , programing,  application development",https://mostaql.com/project/1075843-%D8%AA%D8%B5%D9%85%D9%8A%D9%85-%D9%85%D9%86%D8%B5%D8%A9-%D8%AA%D8%B9%D9%84%D9%8A%D9%85%D9%8A%D8%A9-lms-%D9%85%D8%B1%D8%AA%D8%A8%D8%B7%D8%A9-%D8%A8%D9%86%D8%B8%D8%A7%D9%85-sis-%D9%84%D8%A5%D8%AF%D8%A7%D8%B1%D8%A9-%D9%85%D8%B9%D9%84%D9%88%D9%85%D8%A7%D8%AA-%D8%A7%D9%84%D8%B7%D8%A7%D9%84%D8%A8
386,تطوير موقعي اللإلكتروني وإظهار المنتجات,Web Development,تطوير الويب,2025-04-22,30.00 ,5.0,16,"تطوير البرمجيات, برمجة, برمجة مواقع, بايثون, PHP, جافا سكريبت, HTML, CSS, إدارة المواقع, محسن مواقع الويب من جوجل","application development , programing, programing web, python, PHP, java script, HTML, CSS,  management web,  web web",https://mostaql.com/project/1075599-%D8%AA%D8%B7%D9%88%D9%8A%D8%B1-%D9%85%D9%88%D9%82%D8%B9%D9%8A-%D8%A7%D9%84%D9%84%D8%A5%D9%84%D9%83%D8%AA%D8%B1%D9%88%D9%86%D9%8A-%D9%88%D8%A5%D8%B8%D9%87%D8%A7%D8%B1-%D8%A7%D9%84%D9%85%D9%86%D8%AA%D8%AC%D8%A7%D8%AA
387,مستقل خبير بإنشاء البوتات والذكاء الاصطناعي,Artificial Intelligence / Machine Learning,الذكاء الاصطناعي / تعلم الآلة,2025-04-23,100.00 ,3.0,19,"الذكاء الاصطناعي, بايثون, برمجة أندرويد, تطوير البرمجيات, برمجة قواعد البيانات, برمجة مواقع, برمجة","AI, python, programing android ,  application development , programing data base, programing web, programing",https://mostaql.com/project/1061590-%D9%85%D8%B3%D8%AA%D9%82%D9%84-%D8%AE%D8%A8%D9%8A%D8%B1-%D8%A8%D8%A5%D9%86%D8%B4%D8%A7%D8%A1-%D8%A7%D9%84%D8%A8%D9%88%D8%AA%D8%A7%D8%AA-%D9%88%D8%A7%D9%84%D8%B0%D9%83%D8%A7%D8%A1-%D8%A7%D9%84%D8%A7%D8%B5%D8%B7%D9%86%D8%A7%D8%B9%D9%8A
388,مستقل برمجة باك آند,Web Development,تطوير الويب,2025-04-23,250.00 ,30.0,30,"بايثون, مايكروسوفت إس كيو إل سيرفر, ASP.NET Core, C# Programming, أنجولار, برمجة, Back End, تطوير البرمجيات, هندسة البرمجيات","python,     , ASP.NET Core, C# Programming, , programing, Back End,  application development ,programming engineer",https://mostaql.com/project/1057309-%D9%85%D8%B3%D8%AA%D9%82%D9%84-%D8%A8%D8%B1%D9%85%D8%AC%D8%A9-%D8%A8%D8%A7%D9%83-%D8%A2%D9%86%D8%AF
389,تطوير نظام ذكي للتواصل مع الموردين وخدمة العملاء باستخدام n8n والذكاء الاصطناعي,Data Science,علم البيانات,2025-04-23,300.00 ,2.0,5,"برمجة, الذكاء الاصطناعي, هندسة البرمجيات, تصميم متجر إلكتروني, برمجة التطبيقات, تطوير البرمجيات","programing, AI,programming engineer, design  online market, programing  apps ,  application development",https://mostaql.com/project/1075861-%D8%AA%D8%B7%D9%88%D9%8A%D8%B1-%D9%86%D8%B8%D8%A7%D9%85-%D8%B0%D9%83%D9%8A-%D9%84%D9%84%D8%AA%D9%88%D8%A7%D8%B5%D9%84-%D9%85%D8%B9-%D8%A7%D9%84%D9%85%D9%88%D8%B1%D8%AF%D9%8A%D9%86-%D9%88%D8%AE%D8%AF%D9%85%D8%A9-%D8%A7%D9%84%D8%B9%D9%85%D9%84%D8%A7%D8%A1-%D8%A8%D8%A7%D8%B3%D8%AA%D8%AE%D8%AF%D8%A7%D9%85-n8n-%D9%88%D8%A7%D9%84%D8%B0%D9%83%D8%A7%D8%A1-%D8%A7%D9%84%D8%A7%D8%B5%D8%B7%D9%86%D8%A7%D8%B9%D9%8A
390,موقع ووردبريس بالعربي والإنجليزي,Web Development,تطوير الويب,2025-04-23,100.00 ,7.0,27,"ووردبريس, تصميم موقع إلكتروني, إنشاء موقع ووردبريس, هندسة البرمجيات, تطوير البرمجيات, برمجة, برمجة مواقع, إنشاء موقع إلكتروني, تطوير الويب","wordpress, design web , create web wordpress,programming engineer,  application development , programing, programing web, create web , devweb",https://mostaql.com/project/1075754-%D9%85%D9%88%D9%82%D8%B9-%D9%88%D9%88%D8%B1%D8%AF%D8%A8%D8%B1%D9%8A%D8%B3-%D8%A8%D8%A7%D9%84%D8%B9%D8%B1%D8%A8%D9%8A-%D9%88%D8%A7%D9%84%D8%A5%D9%86%D8%AC%D9%84%D9%8A%D8%B2%D9%8A
391,تطبيق متابعة الحضور والانصراف ( بصمة وجه) للموظفين,Web Development,تطوير الويب,2025-04-23,850.00 ,30.0,17,"تصميم موقع إلكتروني, برمجة أندرويد, flutter, تصميم مواقع, برمجة, برمجة مواقع, تطوير التطبيقات, برمجة التطبيقات","design web , programing android , flutter, design web, programing, programing web, dev apps , programing  apps",https://mostaql.com/project/1065091-%D8%AA%D8%B7%D8%A8%D9%8A%D9%82-%D9%85%D8%AA%D8%A7%D8%A8%D8%B9%D8%A9-%D8%A7%D9%84%D8%AD%D8%B6%D9%88%D8%B1-%D9%88%D8%A7%D9%84%D8%A7%D9%86%D8%B5%D8%B1%D8%A7%D9%81-%D8%A8%D8%B5%D9%85%D8%A9-%D9%88%D8%AC%D9%87-%D9%84%D9%84%D9%85%D9%88%D8%B8%D9%81%D9%8A%D9%86
392,تصميم متجر ووردبريس لبيع المنتجات الرقمية بتسليم فوري,Mobile Development,تطوير التطبيقات,2025-04-23,370.00 ,7.0,5,"تصميم جرافيك, تصميم موقع إلكتروني, ووردبريس, إنشاء موقع ووردبريس, إنشاء متجر إلكتروني","design , design web , wordpress, create web wordpress, create  online market",https://mostaql.com/project/1075651-%D8%AA%D8%B5%D9%85%D9%8A%D9%85-%D9%85%D8%AA%D8%AC%D8%B1-%D9%88%D9%88%D8%B1%D8%AF%D8%A8%D8%B1%D9%8A%D8%B3-%D9%84%D8%A8%D9%8A%D8%B9-%D8%A7%D9%84%D9%85%D9%86%D8%AA%D8%AC%D8%A7%D8%AA-%D8%A7%D9%84%D8%B1%D9%82%D9%85%D9%8A%D8%A9-%D8%A8%D8%AA%D8%B3%D9%84%D9%8A%D9%85-%D9%81%D9%88%D8%B1%D9%8A
393,تعديل على متجر في منصة شوبيفاي,Web Development,تطوير الويب,2025-04-23,30.00 ,2.0,9,"برمجة التطبيقات, هندسة البرمجيات, برمجة قواعد البيانات, تطوير البرمجيات, برمجة, شوبيفاي, قوالب شوبيفاي","programing  apps ,programming engineer, programing data base,  application development , programing, ,",https://mostaql.com/project/1075798-%D8%AA%D8%B9%D8%AF%D9%8A%D9%84-%D8%B9%D9%84%D9%89-%D9%85%D8%AA%D8%AC%D8%B1-%D9%81%D9%8A-%D9%85%D9%86%D8%B5%D8%A9-%D8%B4%D9%88%D8%A8%D9%8A%D9%81%D8%A7%D9%8A
394,حل مشكلة بخانة في لوحة التحكم,Software Engineering,هندسة البرمجيات,2025-04-23,35.00 ,1.0,7,"تصميم موقع إلكتروني, برمجة مواقع, تطوير الويب, برمجة","design web , programing web, devweb, programing",https://mostaql.com/project/1075188-%D8%AD%D9%84-%D9%85%D8%B4%D9%83%D9%84%D8%A9-%D8%A8%D8%AE%D8%A7%D9%86%D8%A9-%D9%81%D9%8A-%D9%84%D9%88%D8%AD%D8%A9-%D8%A7%D9%84%D8%AA%D8%AD%D9%83%D9%85
395,رفع دومين أثورتي لموقعي وتخفيض السبام سكور + إنشاء باك لينكات قوية,Web Development,تطوير الويب,2025-04-23,37.50 ,2.0,2,"محسن مواقع الويب من جوجل, أدوات مشرفي المواقع, مجموعة أدوات الويب من جوجل, برمجة, تطوير البرمجيات, هندسة البرمجيات, برمجة مواقع, اختبار المواقع, اختبار الاختراق","web web ,   web,   web , programing,  application development ,programming engineer, programing web, testing web, testing",https://mostaql.com/project/1075756-%D8%B1%D9%81%D8%B9-%D8%AF%D9%88%D9%85%D9%8A%D9%86-%D8%A3%D8%AB%D9%88%D8%B1%D8%AA%D9%8A-%D9%84%D9%85%D9%88%D9%82%D8%B9%D9%8A-%D9%88%D8%AA%D8%AE%D9%81%D9%8A%D8%B6-%D8%A7%D9%84%D8%B3%D8%A8%D8%A7%D9%85-%D8%B3%D9%83%D9%88%D8%B1-%D8%A5%D9%86%D8%B4%D8%A7%D8%A1-%D8%A8%D8%A7%D9%83-%D9%84%D9%8A%D9%86%D9%83%D8%A7%D8%AA-%D9%82%D9%88%D9%8A%D8%A9
396,تطبيق موبايل MVP مع إمكانية التوسعة المستقبلية,Mobile Development,تطوير التطبيقات,2025-04-23,150.00 ,14.0,20,"تصميم واجهة المستخدم, تصميم UI UX, تصميم تجربة المستخدم, التصميم الإبداعي, تصميم تطبيقات, تصميم تطبيقات الهواتف الذكية, adobe xd","design UI, design UI UX, design UX, design , design  application, design  application mobile, adobe xd",https://mostaql.com/project/1075731-%D8%AA%D8%B7%D8%A8%D9%8A%D9%82-%D9%85%D9%88%D8%A8%D8%A7%D9%8A%D9%84-mvp-%D9%85%D8%B9-%D8%A5%D9%85%D9%83%D8%A7%D9%86%D9%8A%D8%A9-%D8%A7%D9%84%D8%AA%D9%88%D8%B3%D8%B9%D8%A9-%D8%A7%D9%84%D9%85%D8%B3%D8%AA%D9%82%D8%A8%D9%84%D9%8A%D8%A9
397,مركز صيانة سيارات وقطع غيار سيارات,Web Development,تطوير الويب,2025-04-23,500.00 ,15.0,22,"برمجة, هندسة البرمجيات, تطوير البرمجيات, برمجة مواقع, إنشاء موقع إلكتروني, تطوير الويب","programing,programming engineer,  application development , programing web, create web , devweb",https://mostaql.com/project/1075743-%D9%85%D8%B1%D9%83%D8%B2-%D8%B5%D9%8A%D8%A7%D9%86%D8%A9-%D8%B3%D9%8A%D8%A7%D8%B1%D8%A7%D8%AA-%D9%88%D9%82%D8%B7%D8%B9-%D8%BA%D9%8A%D8%A7%D8%B1-%D8%B3%D9%8A%D8%A7%D8%B1%D8%A7%D8%AA
398,مبرمج full stack لإكمال العمل على منصة متعددة البائعين,Web Development,تطوير الويب,2025-04-23,"1,400.00 ",30.0,10,"تطوير البرمجيات, إدارة المواقع, برمجة, برمجة مواقع, بايثون, PHP, جافا سكريبت, HTML, CSS, لارافيل, React","application development ,  management web, programing, programing web, python, PHP, java script, HTML, CSS, laravel, React",https://mostaql.com/project/1075905-%D9%85%D8%A8%D8%B1%D9%85%D8%AC-full-stack-%D9%84%D8%A5%D9%83%D9%85%D8%A7%D9%84-%D8%A7%D9%84%D8%B9%D9%85%D9%84-%D8%B9%D9%84%D9%89-%D9%85%D9%86%D8%B5%D8%A9-%D9%85%D8%AA%D8%B9%D8%AF%D8%AF%D8%A9-%D8%A7%D9%84%D8%A8%D8%A7%D8%A6%D8%B9%D9%8A%D9%86
399,مبرمج لتقديم فيديوهات تعليمية على قناة يوتيوب,Mobile Development,تطوير التطبيقات,2025-04-23,60.00 ,7.0,7,"اللغة العربية, تدريب عن بعد, الإنتاج الصوتي, التعليم الإلكتروني, تصميم فيديو, مونتاج فيديو, إنشاء فيديو يوتيوب, برمجة, إنتاج الفيديو, باوربوينت",",   ,  ,  , design ,  , create  , programing,  ,",https://mostaql.com/project/1075822-%D9%85%D8%A8%D8%B1%D9%85%D8%AC-%D9%84%D8%AA%D9%82%D8%AF%D9%8A%D9%85-%D9%81%D9%8A%D8%AF%D9%8A%D9%88%D9%87%D8%A7%D8%AA-%D8%AA%D8%B9%D9%84%D9%8A%D9%85%D9%8A%D8%A9-%D8%B9%D9%84%D9%89-%D9%82%D9%86%D8%A7%D8%A9-%D9%8A%D9%88%D8%AA%D9%8A%D9%88%D8%A8
400,مرشد القراءة الذكي المدعوم بالذكاء الاصطناعي,Web Development,تطوير الويب,2025-04-23,500.00 ,18.0,8,"التعلم الآلي, الذكاء الاصطناعي, برمجة مواقع, إنشاء موقع إلكتروني, برمجة, تطوير الويب, هندسة البرمجيات, تطوير البرمجيات",", AI, programing web, create web , programing, devweb,programming engineer,  application development",https://mostaql.com/project/1075360-%D9%85%D8%B1%D8%B4%D8%AF-%D8%A7%D9%84%D9%82%D8%B1%D8%A7%D8%A1%D8%A9-%D8%A7%D9%84%D8%B0%D9%83%D9%8A-%D8%A7%D9%84%D9%85%D8%AF%D8%B9%D9%88%D9%85-%D8%A8%D8%A7%D9%84%D8%B0%D9%83%D8%A7%D8%A1-%D8%A7%D9%84%D8%A7%D8%B5%D8%B7%D9%86%D8%A7%D8%B9%D9%8A
401,تسطيب نظام موودل مع عمل بعض الإضافات,Software Engineering,هندسة البرمجيات,2025-04-22,155.00 ,12.0,7,"اللغة العربية, تصميم موقع إلكتروني, PHP, برمجة, تطوير البرمجيات, هندسة البرمجيات, برمجة تطبيقات سطح المكتب",", design web , PHP, programing,  application development ,programming engineer, programing  application",https://mostaql.com/project/1075268-%D8%AA%D8%B3%D8%B7%D9%8A%D8%A8-%D9%86%D8%B8%D8%A7%D9%85-%D9%85%D9%88%D9%88%D8%AF%D9%84-%D9%85%D8%B9-%D8%B9%D9%85%D9%84-%D8%A8%D8%B9%D8%B6-%D8%A7%D9%84%D8%A5%D8%B6%D8%A7%D9%81%D8%A7%D8%AA
402,مطوّر واجهة Qt لتطبيق في مجال الجيولوجيا| Qt UI Developer for Geology Application,Mobile Development,تطوير التطبيقات,2025-04-22,750.00 ,20.0,7,"برمجة, بايثون, تصميم واجهة المستخدم, كتابة تجربة المستخدم, تطوير البرمجيات, هندسة البرمجيات, Front End, برمجة تطبيقات سطح المكتب","programing, python, design UI,  UX,  application development ,programming engineer, Front End, programing  application",https://mostaql.com/project/1075406-%D9%85%D8%B7%D9%88%D8%B1-%D9%88%D8%A7%D8%AC%D9%87%D8%A9-qt-%D9%84%D8%AA%D8%B7%D8%A8%D9%8A%D9%82-%D9%81%D9%8A-%D9%85%D8%AC%D8%A7%D9%84-%D8%A7%D9%84%D8%AC%D9%8A%D9%88%D9%84%D9%88%D8%AC%D9%8A%D8%A7-qt-ui-developer-for-geology-application
403,تسطيب نظام موودل مع إضافة بعض المزايا للنظام,Software Engineering,هندسة البرمجيات,2025-04-22,175.00 ,12.0,4,"اللغة العربية, PHP, تصميم موقع إلكتروني, برمجة مواقع, إنشاء موقع إلكتروني, تطوير الويب",", PHP, design web , programing web, create web , devweb",https://mostaql.com/project/1075532-%D8%AA%D8%B3%D8%B7%D9%8A%D8%A8-%D9%86%D8%B8%D8%A7%D9%85-%D9%85%D9%88%D9%88%D8%AF%D9%84-%D9%85%D8%B9-%D8%A5%D8%B6%D8%A7%D9%81%D8%A9-%D8%A8%D8%B9%D8%B6-%D8%A7%D9%84%D9%85%D8%B2%D8%A7%D9%8A%D8%A7-%D9%84%D9%84%D9%86%D8%B8%D8%A7%D9%85
404,تصميم وتطوير تطبيق هاتف مع ميزات ذكاء اصطناعي مبتكرة من الفكرة إلى المتجر,Web Development,تطوير الويب,2025-04-22,"2,000.00 ",60.0,3,"JavaFX, إنشاء موقع إلكتروني, برمجة, HTML, جافا سكريبت, برمجة قواعد البيانات, C++ Programming","JavaFX, create web , programing, HTML, java script, programing data base, C++ Programming",https://mostaql.com/project/1075276-%D8%AA%D8%B5%D9%85%D9%8A%D9%85-%D9%88%D8%AA%D8%B7%D9%88%D9%8A%D8%B1-%D8%AA%D8%B7%D8%A8%D9%8A%D9%82-%D9%87%D8%A7%D8%AA%D9%81-%D9%85%D8%B9-%D9%85%D9%8A%D8%B2%D8%A7%D8%AA-%D8%B0%D9%83%D8%A7%D8%A1-%D8%A7%D8%B5%D8%B7%D9%86%D8%A7%D8%B9%D9%8A-%D9%85%D8%A8%D8%AA%D9%83%D8%B1%D8%A9-%D9%85%D9%86-%D8%A7%D9%84%D9%81%D9%83%D8%B1%D8%A9-%D8%A5%D9%84%D9%89-%D8%A7%D9%84%D9%85%D8%AA%D8%AC%D8%B1
405,مصمم وورد بريس محترف,Web Development,تطوير الويب,2025-04-22,40.00 ,1.0,19,"ووردبريس, تصميم مواقع, إنشاء موقع ووردبريس, برمجة مواقع, تطوير الويب, خدمات الويب","wordpress, design web, create web wordpress, programing web, devweb,  web",https://mostaql.com/project/1075392-%D9%85%D8%B5%D9%85%D9%85-%D9%88%D9%88%D8%B1%D8%AF-%D8%A8%D8%B1%D9%8A%D8%B3-%D9%85%D8%AD%D8%AA%D8%B1%D9%81
406,محلل نظم أو متخصص UX لتخطيط لوحة تحكم إدارية ومراجعة واجهة عامة,Mobile Development,تطوير التطبيقات,2025-04-22,300.00 ,24.0,13,"برمجة أندرويد, برمجة التطبيقات, برمجة iOS, جافا, كوتلن, Ionic, Swift, تصميم تطبيقات, تصميم تطبيقات الهواتف الذكية, تصميم UI UX, تصميم واجهة المستخدم, تصميم تجربة المستخدم","programing android , programing  apps , programing iOS, java, kotlin, Ionic, Swift, design  application, design  application mobile, design UI UX, design UI, design UX",https://mostaql.com/project/1075386-%D9%85%D8%AD%D9%84%D9%84-%D9%86%D8%B8%D9%85-%D8%A3%D9%88-%D9%85%D8%AA%D8%AE%D8%B5%D8%B5-ux-%D9%84%D8%AA%D8%AE%D8%B7%D9%8A%D8%B7-%D9%84%D9%88%D8%AD%D8%A9-%D8%AA%D8%AD%D9%83%D9%85-%D8%A5%D8%AF%D8%A7%D8%B1%D9%8A%D8%A9-%D9%88%D9%85%D8%B1%D8%A7%D8%AC%D8%B9%D8%A9-%D9%88%D8%A7%D8%AC%D9%87%D8%A9-%D8%B9%D8%A7%D9%85%D8%A9
407,تطبيق عروض وحجوزات المتاجر والخدمات المحلية,Web Development,تطوير الويب,2025-04-22,"2,000.00 ",120.0,22,"لارافيل, MySQL, PHP, flutter, Back End, Front End, برمجة iOS, برمجة التطبيقات, برمجة أندرويد","laravel, MySQL, PHP, flutter, Back End, Front End, programing iOS, programing  apps , programing android",https://mostaql.com/project/1074742-%D8%AA%D8%B7%D8%A8%D9%8A%D9%82-%D8%B9%D8%B1%D9%88%D8%B6-%D9%88%D8%AD%D8%AC%D9%88%D8%B2%D8%A7%D8%AA-%D8%A7%D9%84%D9%85%D8%AA%D8%A7%D8%AC%D8%B1-%D9%88%D8%A7%D9%84%D8%AE%D8%AF%D9%85%D8%A7%D8%AA-%D8%A7%D9%84%D9%85%D8%AD%D9%84%D9%8A%D8%A9
408,عمل برنامج أو إضافة لمتصفح جوجل كروم,Web Development,تطوير الويب,2025-04-22,150.00 ,30.0,3,"برمجة التطبيقات, برمجة, تطوير البرمجيات, برمجة قواعد البيانات, برمجة مواقع, هندسة البرمجيات, flutter","programing  apps , programing,  application development , programing data base, programing web,programming engineer, flutter",https://mostaql.com/project/1075347-%D8%B9%D9%85%D9%84-%D8%A8%D8%B1%D9%86%D8%A7%D9%85%D8%AC-%D8%A3%D9%88-%D8%A5%D8%B6%D8%A7%D9%81%D8%A9-%D9%84%D9%85%D8%AA%D8%B5%D9%81%D8%AD-%D8%AC%D9%88%D8%AC%D9%84-%D9%83%D8%B1%D9%88%D9%85
409,مطور لإضافة مهمة Alkher app,Software Engineering,هندسة البرمجيات,2025-04-22,42.50 ,1.0,4,"Back End, ASP.NET, هندسة البرمجيات, برمجة, تطوير البرمجيات, flutter","Back End, ASP.NET,programming engineer, programing,  application development , flutter",https://mostaql.com/project/1073999-%D9%85%D8%B7%D9%88%D8%B1-%D9%84%D8%A5%D8%B6%D8%A7%D9%81%D8%A9-%D9%85%D9%87%D9%85%D8%A9-alkher-app
410,عالم بيانات لعمل نموذج لغوي,Data Science,علم البيانات,2025-04-22,200.00 ,5.0,10,"معالجة البيانات, التعلم الآلي, برمجة, تطوير البرمجيات, هندسة البرمجيات",",  , programing,  application development ,programming engineer",https://mostaql.com/project/1075513-%D8%B9%D8%A7%D9%84%D9%85-%D8%A8%D9%8A%D8%A7%D9%86%D8%A7%D8%AA-%D9%84%D8%B9%D9%85%D9%84-%D9%86%D9%85%D9%88%D8%B0%D8%AC-%D9%84%D8%BA%D9%88%D9%8A
411,دمج بوت واتساب مع دعم تعدد المستأجرين (Multi-Tenant),Software Engineering,هندسة البرمجيات,2025-04-22,825.00 ,30.0,4,"ASP.NET Core, الذكاء الاصطناعي, برمجة, هندسة البرمجيات, تطوير البرمجيات, برمجة التطبيقات, تطوير التطبيقات","ASP.NET Core, AI, programing,programming engineer,  application development , programing  apps , dev apps",https://mostaql.com/project/1075260-%D8%AF%D9%85%D8%AC-%D8%A8%D9%88%D8%AA-%D9%88%D8%A7%D8%AA%D8%B3%D8%A7%D8%A8-%D9%85%D8%B9-%D8%AF%D8%B9%D9%85-%D8%AA%D8%B9%D8%AF%D8%AF-%D8%A7%D9%84%D9%85%D8%B3%D8%AA%D8%A3%D8%AC%D8%B1%D9%8A%D9%86-multi-tenant
412,تطوير واجهة مستخدم تفاعلية,Web Development,تطوير الويب,2025-04-22,45.00 ,22.0,29,"تطوير البرمجيات, استكشاف الأخطاء وإصلاحها, برمجة مواقع, بايثون, PHP, HTML, CSS, جافا سكريبت","application development ,   , programing web, python, PHP, HTML, CSS, java script",https://mostaql.com/project/1075379-%D8%AA%D8%B7%D9%88%D9%8A%D8%B1-%D9%88%D8%A7%D8%AC%D9%87%D8%A9-%D9%85%D8%B3%D8%AA%D8%AE%D8%AF%D9%85-%D8%AA%D9%81%D8%A7%D8%B9%D9%84%D9%8A%D8%A9
413,"مستقل خبير واجهة مستخدم , css , html",Web Development,تطوير الويب,2025-04-22,36.00 ,7.0,62,"تصميم واجهة المستخدم, تصميم UI UX, CSS, تصميم موقع إلكتروني","design UI, design UI UX, CSS, design web",https://mostaql.com/project/1075317-%D9%85%D8%B3%D8%AA%D9%82%D9%84-%D8%AE%D8%A8%D9%8A%D8%B1-%D9%88%D8%A7%D8%AC%D9%87%D8%A9-%D9%85%D8%B3%D8%AA%D8%AE%D8%AF%D9%85-css-html
414,مبرمج لتطوير تطبيق موبايل ولوحة تحكم مرتبطة بنظام الفوترة الأردني JoFotara,Web Development,تطوير الويب,2025-04-22,"1,900.00 ",20.0,13,"تصميم تطبيقات, برمجة أندرويد, برمجة iOS, flutter, Back End","design  application, programing android , programing iOS, flutter, Back End",https://mostaql.com/project/1075501-%D9%85%D8%A8%D8%B1%D9%85%D8%AC-%D9%84%D8%AA%D8%B7%D9%88%D9%8A%D8%B1-%D8%AA%D8%B7%D8%A8%D9%8A%D9%82-%D9%85%D9%88%D8%A8%D8%A7%D9%8A%D9%84-%D9%88%D9%84%D9%88%D8%AD%D8%A9-%D8%AA%D8%AD%D9%83%D9%85-%D9%85%D8%B1%D8%AA%D8%A8%D8%B7%D8%A9-%D8%A8%D9%86%D8%B8%D8%A7%D9%85-%D8%A7%D9%84%D9%81%D9%88%D8%AA%D8%B1%D8%A9-%D8%A7%D9%84%D8%A3%D8%B1%D8%AF%D9%86%D9%8A-jofotara
415,طباعة فواتير باستخدام Flutter,Mobile Development,تطوير التطبيقات,2025-04-22,150.00 ,4.0,9,"flutter, برمجة, تطوير البرمجيات, برمجة قواعد البيانات, برمجة مواقع, هندسة البرمجيات","flutter, programing,  application development , programing data base, programing web,programming engineer",https://mostaql.com/project/1075306-%D8%B7%D8%A8%D8%A7%D8%B9%D8%A9-%D9%81%D9%88%D8%A7%D8%AA%D9%8A%D8%B1-%D8%A8%D8%A7%D8%B3%D8%AA%D8%AE%D8%AF%D8%A7%D9%85-flutter
416,برنامج مبيعات تجزئة بثلاث لغات بالإضافة لنظام TSE الألماني (اأوف لاين) فقط,Software Engineering,هندسة البرمجيات,2025-04-22,"1,190.00 ",30.0,5,"برمجة, برمجة التطبيقات, تطوير التطبيقات, برمجة تطبيقات سطح المكتب, فيجوال بيسك للتطبيقات, تطوير البرمجيات, هندسة البرمجيات","programing, programing  apps , dev apps , programing  application  ,    application,  application development ,programming engineer",https://mostaql.com/project/1075270-%D8%A8%D8%B1%D9%86%D8%A7%D9%85%D8%AC-%D9%85%D8%A8%D9%8A%D8%B9%D8%A7%D8%AA-%D8%AA%D8%AC%D8%B2%D8%A6%D8%A9-%D8%A8%D8%AB%D9%84%D8%A7%D8%AB-%D9%84%D8%BA%D8%A7%D8%AA-%D8%A8%D8%A7%D9%84%D8%A5%D8%B6%D8%A7%D9%81%D8%A9-%D9%84%D9%86%D8%B8%D8%A7%D9%85-tse-%D8%A7%D9%84%D8%A3%D9%84%D9%85%D8%A7%D9%86%D9%8A-%D8%A7%D8%A3%D9%88%D9%81-%D9%84%D8%A7%D9%8A%D9%86-%D9%81%D9%82%D8%B7
417,برمجة بوت تنبيهات تيليجرام لتطبيق سهل سيل,Web Development,تطوير الويب,2025-04-22,100.00 ,3.0,10,"برمجة التطبيقات, برمجة, تطوير البرمجيات, بايثون, node.js","programing  apps , programing,  application development , python, node.js",https://mostaql.com/project/1075514-%D8%A8%D8%B1%D9%85%D8%AC%D8%A9-%D8%A8%D9%88%D8%AA-%D8%AA%D9%86%D8%A8%D9%8A%D9%87%D8%A7%D8%AA-%D8%AA%D9%8A%D9%84%D9%8A%D8%AC%D8%B1%D8%A7%D9%85-%D9%84%D8%AA%D8%B7%D8%A8%D9%8A%D9%82-%D8%B3%D9%87%D9%84-%D8%B3%D9%8A%D9%84
418,تصميم وبرمجة موقع متجر إلكتروني شبيه بمنصة سلة و زد,Web Development,تطوير الويب,2025-04-22,"2,500.00 ",90.0,9,"تصميم متجر إلكتروني, إدارة قواعد البيانات, برمجة التطبيقات","design  online market,  data base, programing  apps",https://mostaql.com/project/1075293-%D8%AA%D8%B5%D9%85%D9%8A%D9%85-%D9%88%D8%A8%D8%B1%D9%85%D8%AC%D8%A9-%D9%85%D9%88%D9%82%D8%B9-%D9%85%D8%AA%D8%AC%D8%B1-%D8%A5%D9%84%D9%83%D8%AA%D8%B1%D9%88%D9%86%D9%8A-%D8%B4%D8%A8%D9%8A%D9%87-%D8%A8%D9%85%D9%86%D8%B5%D8%A9-%D8%B3%D9%84%D8%A9-%D9%88-%D8%B2%D8%AF
419,تصميم كشك وستاند,Software Engineering,هندسة البرمجيات,2025-04-22,142.00 ,30.0,7,"إظهار معماري, تصميم مخططات معمارية, البناء المعماري, الفكرة التصميمية",", design  ,  ,  design",https://mostaql.com/project/1071786-%D8%AA%D8%B5%D9%85%D9%8A%D9%85-%D9%83%D8%B4%D9%83-%D9%88%D8%B3%D8%AA%D8%A7%D9%86%D8%AF
