ID,Title,Category_English,category_arabic,Posted,Avg offer,Duration(Days),Number of Offers,Tags,Tags_en,Link
619,خبير UI/UX متفرغ لتنفيذ مشروع واجهات رقمي ضخم,Web Development,تطوير الويب,2025-04-30,235.00 ,30.0,12,"Figma, adobe xd, التصميم المتجاوب, تصميم UI UX, تصميم مواقع, برمجة, تطوير البرمجيات, هندسة البرمجيات","Figma, adobe xd, design , design UI UX, design web, programing,  application development ,programming engineer",https://mostaql.com/project/1072783-%D8%AE%D8%A8%D9%8A%D8%B1-uiux-%D9%85%D8%AA%D9%81%D8%B1%D8%BA-%D9%84%D8%AA%D9%86%D9%81%D9%8A%D8%B0-%D9%85%D8%B4%D8%B1%D9%88%D8%B9-%D9%88%D8%A7%D8%AC%D9%87%D8%A7%D8%AA-%D8%B1%D9%82%D9%85%D9%8A-%D8%B6%D8%AE%D9%85
620,مبرمج flutter لمتابعة العمل على تطبيق ورفعه على المتاجر,Mobile Development,تطوير التطبيقات,2025-04-30,80.00 ,2.0,12,"flutter, تطوير البرمجيات, برمجة قواعد البيانات, برمجة, برمجة مواقع, هندسة البرمجيات, برمجة التطبيقات","flutter,  application development , programing data base, programing, programing web,programming engineer, programing  apps",https://mostaql.com/project/1072679-%D9%85%D8%A8%D8%B1%D9%85%D8%AC-flutter-%D9%84%D9%85%D8%AA%D8%A7%D8%A8%D8%B9%D8%A9-%D8%A7%D9%84%D8%B9%D9%85%D9%84-%D8%B9%D9%84%D9%89-%D8%AA%D8%B7%D8%A8%D9%8A%D9%82-%D9%88%D8%B1%D9%81%D8%B9%D9%87-%D8%B9%D9%84%D9%89-%D8%A7%D9%84%D9%85%D8%AA%D8%A7%D8%AC%D8%B1
621,تصميم واجهات تطبيق UI/UX تفاعلي شامل,Mobile Development,تطوير التطبيقات,2025-04-30,100.00 ,7.0,25,"تصميم UI UX, تصميم جرافيك, التصميم الإبداعي, تصميم شعار, تصميم تطبيقات iOS, تصميم تطبيقات","design UI UX, design , design , design , design  application iOS, design  application",https://mostaql.com/project/1072845-%D8%AA%D8%B5%D9%85%D9%8A%D9%85-%D9%88%D8%A7%D8%AC%D9%87%D8%A7%D8%AA-%D8%AA%D8%B7%D8%A8%D9%8A%D9%82-uiux-%D8%AA%D9%81%D8%A7%D8%B9%D9%84%D9%8A-%D8%B4%D8%A7%D9%85%D9%84
622,تصميم وبرمجة لعبة سباق سيارات قتالية واقعية بطابع ما بعد الكارثة,Web Development,تطوير الويب,2025-04-30,"3,000.00 ",30.0,7,"تصميم 3D, برمجة أندرويد, برمجة ألعاب الجوال, تطوير الألعاب, تصميم ألعاب, تطوير البرمجيات, هندسة البرمجيات, برمجة","design 3D, programing android , programing  , dev, design ,  application development ,programming engineer, programing",https://mostaql.com/project/1072772-%D8%AA%D8%B5%D9%85%D9%8A%D9%85-%D9%88%D8%A8%D8%B1%D9%85%D8%AC%D8%A9-%D9%84%D8%B9%D8%A8%D8%A9-%D8%B3%D8%A8%D8%A7%D9%82-%D8%B3%D9%8A%D8%A7%D8%B1%D8%A7%D8%AA-%D9%82%D8%AA%D8%A7%D9%84%D9%8A%D8%A9-%D9%88%D8%A7%D9%82%D8%B9%D9%8A%D8%A9-%D8%A8%D8%B7%D8%A7%D8%A8%D8%B9-%D9%85%D8%A7-%D8%A8%D8%B9%D8%AF-%D8%A7%D9%84%D9%83%D8%A7%D8%B1%D8%AB%D8%A9
623,تجهيز دليل مستخدم,Artificial Intelligence / Machine Learning,الذكاء الاصطناعي / تعلم الآلة,2025-04-30,35.00 ,7.0,5,"كتابة المحتوى, تصميم موقع إلكتروني, التدقيق اللغوي, جافا سكريبت, البحث والتطوير, تحرير المحتوى, HTML, CSS, PHP, برمجة التطبيقات",", design web ,  , java script,  ,  , HTML, CSS, PHP, programing  apps",https://mostaql.com/project/1072739-%D8%AA%D8%AC%D9%87%D9%8A%D8%B2-%D8%AF%D9%84%D9%8A%D9%84-%D9%85%D8%B3%D8%AA%D8%AE%D8%AF%D9%85
624,مطور تطبيقات جواللتعديل تطبيق,Mobile Development,تطوير التطبيقات,2025-04-30,50.00 ,3.0,8,"برمجة مواقع, تطوير البرمجيات, تطوير التطبيقات, PHP, React Native, Back End, Front End","programing web,  application development , dev apps , PHP, React Native, Back End, Front End",https://mostaql.com/project/1072751-%D9%85%D8%B7%D9%88%D8%B1-%D8%AA%D8%B7%D8%A8%D9%8A%D9%82%D8%A7%D8%AA-%D8%AC%D9%88%D8%A7%D9%84%D9%84%D8%AA%D8%B9%D8%AF%D9%8A%D9%84-%D8%AA%D8%B7%D8%A8%D9%8A%D9%82
625,إنشاء Dashboard باستخدام Power BI,Data Science,علم البيانات,2025-04-30,30.00 ,3.0,54,"Power BI, التحليل المالي, تحليل الأعمال, تحليل الأسواق المالية, الإدارة المالية","Power BI,  ,  ,   ,  management",https://mostaql.com/project/1072685-%D8%A5%D9%86%D8%B4%D8%A7%D8%A1-dashboard-%D8%A8%D8%A7%D8%B3%D8%AA%D8%AE%D8%AF%D8%A7%D9%85-power-bi
626,مبرمج لديه خبره في عمل بوت لحجز التذاكر في موقع ويبوك WEBOOK,Web Development,تطوير الويب,2025-04-30,60.00 ,7.0,5,"الروبوتات, جافا, جافا سكريبت, HTML, بايثون",", java, java script, HTML, python",https://mostaql.com/project/1072608-%D9%85%D8%A8%D8%B1%D9%85%D8%AC-%D9%84%D8%AF%D9%8A%D9%87-%D8%AE%D8%A8%D8%B1%D9%87-%D9%81%D9%8A-%D8%B9%D9%85%D9%84-%D8%A8%D9%88%D8%AA-%D9%84%D8%AD%D8%AC%D8%B2-%D8%A7%D9%84%D8%AA%D8%B0%D8%A7%D9%83%D8%B1-%D9%81%D9%8A-%D9%85%D9%88%D9%82%D8%B9-%D9%88%D9%8A%D8%A8%D9%88%D9%83-webook
627,تطبيق منصة تعليمية,Mobile Development,تطوير التطبيقات,2025-04-30,"1,600.00 ",15.0,27,"برمجة أندرويد, برمجة التطبيقات, برمجة iOS, جافا, كوتلن, Ionic, Swift, تصميم تطبيقات, تصميم تطبيقات الهواتف الذكية, تصميم UI UX, تصميم واجهة المستخدم, تصميم تجربة المستخدم","programing android , programing  apps , programing iOS, java, kotlin, Ionic, Swift, design  application, design  application mobile, design UI UX, design UI, design UX",https://mostaql.com/project/1072369-%D8%AA%D8%B7%D8%A8%D9%8A%D9%82-%D9%85%D9%86%D8%B5%D8%A9-%D8%AA%D8%B9%D9%84%D9%8A%D9%85%D9%8A%D8%A9
628,تعديل الأسعار في صفحة المنتج موقع سلة,Software Engineering,هندسة البرمجيات,2025-04-30,87.50 ,2.0,8,"CSS, تصميم موقع إلكتروني, برمجة, تطوير البرمجيات, برمجة قواعد البيانات, برمجة التطبيقات, هندسة البرمجيات, برمجة مواقع","CSS, design web , programing,  application development , programing data base, programing  apps ,programming engineer, programing web",https://mostaql.com/project/1072375-%D8%AA%D8%B9%D8%AF%D9%8A%D9%84-%D8%A7%D9%84%D8%A3%D8%B3%D8%B9%D8%A7%D8%B1-%D9%81%D9%8A-%D8%B5%D9%81%D8%AD%D8%A9-%D8%A7%D9%84%D9%85%D9%86%D8%AA%D8%AC-%D9%85%D9%88%D9%82%D8%B9-%D8%B3%D9%84%D8%A9
629,برمجة سيرفر فايف ام,Software Engineering,هندسة البرمجيات,2025-04-30,"1,000.00 ",20.0,1,"برمجة, خدمات الويب, ويندوز سيرفر, تطوير البرمجيات, هندسة البرمجيات","programing,  web,  ,  application development ,programming engineer",https://mostaql.com/project/1072465-%D8%A8%D8%B1%D9%85%D8%AC%D8%A9-%D8%B3%D9%8A%D8%B1%D9%81%D8%B1-%D9%81%D8%A7%D9%8A%D9%81-%D8%A7%D9%85
630,برمجة موقع إلكتروني تعريفي لمصور,Web Development,تطوير الويب,2025-04-30,250.00 ,30.0,80,"تصميم موقع إلكتروني, برمجة مواقع, أمن وحماية المواقع, بايثون, PHP, CSS, جافا سكريبت, تطوير الويب, تصميم مواقع","design web , programing web,   web, python, PHP, CSS, java script, devweb, design web",https://mostaql.com/project/1072481-%D8%A8%D8%B1%D9%85%D8%AC%D8%A9-%D9%85%D9%88%D9%82%D8%B9-%D8%A5%D9%84%D9%83%D8%AA%D8%B1%D9%88%D9%86%D9%8A-%D8%AA%D8%B9%D8%B1%D9%8A%D9%81%D9%8A-%D9%84%D9%85%D8%B5%D9%88%D8%B1
631,تصميم شاشات برنامج سطح مكتب,Mobile Development,تطوير التطبيقات,2025-04-30,200.00 ,20.0,9,"برمجة, برمجة قواعد البيانات, برمجة مواقع, برمجة التطبيقات, تطوير البرمجيات, هندسة البرمجيات, فيجوال بيسك للتطبيقات","programing, programing data base, programing web, programing  apps ,  application development ,programming engineer,    application",https://mostaql.com/project/1072393-%D8%AA%D8%B5%D9%85%D9%8A%D9%85-%D8%B4%D8%A7%D8%B4%D8%A7%D8%AA-%D8%A8%D8%B1%D9%86%D8%A7%D9%85%D8%AC-%D8%B3%D8%B7%D8%AD-%D9%85%D9%83%D8%AA%D8%A8
632,سحب بيانات مواقع,Web Development,تطوير الويب,2025-04-30,25.00 ,3.0,25,"خدمة العملاء, إدخال بيانات, برمجة, تطوير البرمجيات, برمجة قواعد البيانات, برمجة التطبيقات, برمجة مواقع, هندسة البرمجيات",",  , programing,  application development , programing data base, programing  apps , programing web,programming engineer",https://mostaql.com/project/1072656-%D8%B3%D8%AD%D8%A8-%D8%A8%D9%8A%D8%A7%D9%86%D8%A7%D8%AA-%D9%85%D9%88%D8%A7%D9%82%D8%B9
633,إنشاء وتطوير لمودل عمل قابل للتطبيق والإختبار,Web Development,تطوير الويب,2025-04-30,75.00 ,30.0,0,"خطة عمل, التصميم التعليمي, التعليم الإلكتروني, تدريب عن بعد, بوتستراب, الإعلان, كتابة المحتوى, تصميم جرافيك, التصميم الإبداعي, تصميم شعار, تصميم إعلان, تعديل الصور, تصميم بوسترات, الفكرة التصميمية, البحث على الإنترنت",", design ,  ,   , bootstrap, ,  , design , design , design , design ,  , design ,  design,",https://mostaql.com/project/1069577-%D8%A5%D9%86%D8%B4%D8%A7%D8%A1-%D9%88%D8%AA%D8%B7%D9%88%D9%8A%D8%B1-%D9%84%D9%85%D9%88%D8%AF%D9%84-%D8%B9%D9%85%D9%84-%D9%82%D8%A7%D8%A8%D9%84-%D9%84%D9%84%D8%AA%D8%B7%D8%A8%D9%8A%D9%82-%D9%88%D8%A7%D9%84%D8%A5%D8%AE%D8%AA%D8%A8%D8%A7%D8%B1
634,تصميم وتنفيذ موقع إلكتروني,Web Development,تطوير الويب,2025-04-30,200.00 ,3.0,22,"تصميم موقع إلكتروني, برمجة مواقع, أمن وحماية المواقع, بايثون, PHP, CSS, جافا سكريبت","design web , programing web,   web, python, PHP, CSS, java script",https://mostaql.com/project/1072576-%D8%AA%D8%B5%D9%85%D9%8A%D9%85-%D9%88%D8%AA%D9%86%D9%81%D9%8A%D8%B0-%D9%85%D9%88%D9%82%D8%B9-%D8%A5%D9%84%D9%83%D8%AA%D8%B1%D9%88%D9%86%D9%8A
635,مصمم ومطور لتصميم وتثبيت ونشر تطبيق خدمات,Web Development,تطوير الويب,2025-04-30,37.50 ,5.0,2,"برمجة قواعد البيانات, تطوير البرمجيات, برمجة مواقع, برمجة التطبيقات, برمجة, هندسة البرمجيات, flutter","programing data base,  application development , programing web, programing  apps , programing,programming engineer, flutter",https://mostaql.com/project/1072636-%D9%85%D8%B5%D9%85%D9%85-%D9%88%D9%85%D8%B7%D9%88%D8%B1-%D9%84%D8%AA%D8%B5%D9%85%D9%8A%D9%85-%D9%88%D8%AA%D8%AB%D8%A8%D9%8A%D8%AA-%D9%88%D9%86%D8%B4%D8%B1-%D8%AA%D8%B7%D8%A8%D9%8A%D9%82-%D8%AE%D8%AF%D9%85%D8%A7%D8%AA
636,مبرمج مبدع لبناء نظام إلكتروني لإدارة الاجتماعات داخل شركة,Web Development,تطوير الويب,2025-04-30,"2,400.00 ",60.0,18,"تصميم موقع إلكتروني, برمجة مواقع, أمن وحماية المواقع, بايثون, PHP, CSS, جافا سكريبت, برمجة التطبيقات, flutter, HTML, هندسة البرمجيات, تطوير البرمجيات","design web , programing web,   web, python, PHP, CSS, java script, programing  apps , flutter, HTML,programming engineer,  application development",https://mostaql.com/project/1072518-%D9%85%D8%A8%D8%B1%D9%85%D8%AC-%D9%85%D8%A8%D8%AF%D8%B9-%D9%84%D8%A8%D9%86%D8%A7%D8%A1-%D9%86%D8%B8%D8%A7%D9%85-%D8%A5%D9%84%D9%83%D8%AA%D8%B1%D9%88%D9%86%D9%8A-%D9%84%D8%A5%D8%AF%D8%A7%D8%B1%D8%A9-%D8%A7%D9%84%D8%A7%D8%AC%D8%AA%D9%85%D8%A7%D8%B9%D8%A7%D8%AA-%D8%AF%D8%A7%D8%AE%D9%84-%D8%B4%D8%B1%D9%83%D8%A9
637,برمجة MQL,Software Engineering,هندسة البرمجيات,2025-04-30,150.00 ,5.0,4,"تطوير البرمجيات, برمجة قواعد البيانات, برمجة مواقع, برمجة التطبيقات, برمجة, هندسة البرمجيات","application development , programing data base, programing web, programing  apps , programing,programming engineer",https://mostaql.com/project/1072653-%D8%A8%D8%B1%D9%85%D8%AC%D8%A9-mql
638,مبرمج قام بالعمل على موقع BEin و managemango,Web Development,تطوير الويب,2025-04-30,150.00 ,10.0,3,"node.js, MySQL, جافا, برمجة أندرويد, برمجة, تطوير البرمجيات, برمجة مواقع, برمجة قواعد البيانات, هندسة البرمجيات","node.js, MySQL, java, programing android , programing,  application development , programing web, programing data base,programming engineer",https://mostaql.com/project/1072381-%D9%85%D8%A8%D8%B1%D9%85%D8%AC-%D9%82%D8%A7%D9%85-%D8%A8%D8%A7%D9%84%D8%B9%D9%85%D9%84-%D8%B9%D9%84%D9%89-%D9%85%D9%88%D9%82%D8%B9-bein-%D9%88-managemango
639,مطور ووردبريس متمكن لإنشاء وتطوير موقع إلكتروني احترافي,Web Development,تطوير الويب,2025-04-30,50.00 ,3.0,11,"تصميم موقع إلكتروني, ووردبريس, إنشاء موقع ووردبريس, تطوير الويب, برمجة","design web , wordpress, create web wordpress, devweb, programing",https://mostaql.com/project/1072602-%D9%85%D8%B7%D9%88%D8%B1-%D9%88%D9%88%D8%B1%D8%AF%D8%A8%D8%B1%D9%8A%D8%B3-%D9%85%D8%AA%D9%85%D9%83%D9%86-%D9%84%D8%A5%D9%86%D8%B4%D8%A7%D8%A1-%D9%88%D8%AA%D8%B7%D9%88%D9%8A%D8%B1-%D9%85%D9%88%D9%82%D8%B9-%D8%A5%D9%84%D9%83%D8%AA%D8%B1%D9%88%D9%86%D9%8A-%D8%A7%D8%AD%D8%AA%D8%B1%D8%A7%D9%81%D9%8A
640,تطبيق جوال للتجارة الإلكترونية,Mobile Development,تطوير التطبيقات,2025-04-30,100.00 ,3.0,5,"الذكاء الاصطناعي, Adobe Illustrator, التصميم الإبداعي, التدقيق اللغوي, تصميم تطبيقات, برمجة تطبيقات أيفون, تطوير التطبيقات, واجهة برمجة التطبيقات, اختبار تطبيقات الجوال, برمجة iOS, برمجة التطبيقات, تصميم تطبيقات الهواتف الذكية, تصميم تطبيقات iOS, إنشاء تطبيق","AI, Adobe Illustrator, design ,  , design  application, programing  application , dev apps ,  programing  apps , testing  application , programing iOS, programing  apps , design  application mobile, design  application iOS, create  application",https://mostaql.com/project/1072247-%D8%AA%D8%B7%D8%A8%D9%8A%D9%82-%D8%AC%D9%88%D8%A7%D9%84-%D9%84%D9%84%D8%AA%D8%AC%D8%A7%D8%B1%D8%A9-%D8%A7%D9%84%D8%A5%D9%84%D9%83%D8%AA%D8%B1%D9%88%D9%86%D9%8A%D8%A9
641,إدارة وتطوير المواقع - أودو,Web Development,تطوير الويب,2025-04-30,275.00 ,1.0,6,"تصميم موقع إلكتروني, برمجة مواقع, أمن وحماية المواقع, بايثون, PHP, CSS, جافا سكريبت","design web , programing web,   web, python, PHP, CSS, java script",https://mostaql.com/project/1072527-%D8%A5%D8%AF%D8%A7%D8%B1%D8%A9-%D9%88%D8%AA%D8%B7%D9%88%D9%8A%D8%B1-%D8%A7%D9%84%D9%85%D9%88%D8%A7%D9%82%D8%B9-%D8%A3%D9%88%D8%AF%D9%88
642,برنامج دردشة صوتية,Web Development,تطوير الويب,2025-04-30,"1,500.00 ",50.0,12,"تصميم واجهة المستخدم, تصميم UI UX, تصميم تجربة المستخدم, التصميم الإبداعي, تصميم تطبيقات, تصميم تطبيقات الهواتف الذكية, adobe xd","design UI, design UI UX, design UX, design , design  application, design  application mobile, adobe xd",https://mostaql.com/project/1072424-%D8%A8%D8%B1%D9%86%D8%A7%D9%85%D8%AC-%D8%AF%D8%B1%D8%AF%D8%B4%D8%A9-%D8%B5%D9%88%D8%AA%D9%8A%D8%A9
643,تنفيذ مشروع تطوير نموذج ذكي تجريبي يهدف إلى تحسين الخدمات في مجمع طبي,Data Science,علم البيانات,2025-04-30,850.00 ,30.0,5,"الذكاء الاصطناعي, التعلم الآلي, برمجة, تطوير البرمجيات, برمجة قواعد البيانات, برمجة مواقع, هندسة البرمجيات, برمجة التطبيقات, flutter","AI,  , programing,  application development , programing data base, programing web,programming engineer, programing  apps , flutter",https://mostaql.com/project/1072637-%D8%AA%D9%86%D9%81%D9%8A%D8%B0-%D9%85%D8%B4%D8%B1%D9%88%D8%B9-%D8%AA%D8%B7%D9%88%D9%8A%D8%B1-%D9%86%D9%85%D9%88%D8%B0%D8%AC-%D8%B0%D9%83%D9%8A-%D8%AA%D8%AC%D8%B1%D9%8A%D8%A8%D9%8A-%D9%8A%D9%87%D8%AF%D9%81-%D8%A5%D9%84%D9%89-%D8%AA%D8%AD%D8%B3%D9%8A%D9%86-%D8%A7%D9%84%D8%AE%D8%AF%D9%85%D8%A7%D8%AA-%D9%81%D9%8A-%D9%85%D8%AC%D9%85%D8%B9-%D8%B7%D8%A8%D9%8A
644,موقع وتطبيق جوال,Web Development,تطوير الويب,2025-04-30,"1,000.00 ",90.0,15,"تطوير البرمجيات, تصميم موقع إلكتروني, هندسة البرمجيات, برمجة تطبيقات أيفون, برمجة أندرويد, برمجة iOS, برمجة التطبيقات, برمجة مواقع, برمجة","application development , design web ,programming engineer, programing  application , programing android , programing iOS, programing  apps , programing web, programing",https://mostaql.com/project/1072578-%D9%85%D9%88%D9%82%D8%B9-%D9%88%D8%AA%D8%B7%D8%A8%D9%8A%D9%82-%D8%AC%D9%88%D8%A7%D9%84
645,تصميم شعار لمشروع ورشة ألمنيوم,Software Engineering,هندسة البرمجيات,2025-04-30,30.00 ,2.0,18,"فوتوشوب, تصميم جرافيك, تصميم شعار, التصميم الإبداعي, تعديل الصور, Adobe Illustrator, تصميم بوسترات","photoshop, design , design , design ,  , Adobe Illustrator, design",https://mostaql.com/project/1072394-%D8%AA%D8%B5%D9%85%D9%8A%D9%85-%D8%B4%D8%B9%D8%A7%D8%B1-%D9%84%D9%85%D8%B4%D8%B1%D9%88%D8%B9-%D9%88%D8%B1%D8%B4%D8%A9-%D8%A3%D9%84%D9%85%D9%86%D9%8A%D9%88%D9%85
646,منصة لشركة غير ربحية,Software Engineering,هندسة البرمجيات,2025-04-30,"1,000.00 ",80.0,22,"جافا سكريبت, CSS, PHP, بايثون, أمن وحماية المواقع, برمجة مواقع, تصميم موقع إلكتروني","java script, CSS, PHP, python,   web, programing web, design web",https://mostaql.com/project/1071830-%D9%85%D9%86%D8%B5%D8%A9-%D9%84%D8%B4%D8%B1%D9%83%D8%A9-%D8%BA%D9%8A%D8%B1-%D8%B1%D8%A8%D8%AD%D9%8A%D8%A9
647,تصميم وتطوير موقع ووردبريس احترافي لمبادرة تمكين إنسان,Web Development,تطوير الويب,2025-04-30,390.00 ,15.0,23,"ووردبريس, برمجة قواعد البيانات, تطوير البرمجيات, برمجة مواقع, برمجة, برمجة التطبيقات, هندسة البرمجيات, flutter","wordpress, programing data base,  application development , programing web, programing, programing  apps ,programming engineer, flutter",https://mostaql.com/project/1072654-%D8%AA%D8%B5%D9%85%D9%8A%D9%85-%D9%88%D8%AA%D8%B7%D9%88%D9%8A%D8%B1-%D9%85%D9%88%D9%82%D8%B9-%D9%88%D9%88%D8%B1%D8%AF%D8%A8%D8%B1%D9%8A%D8%B3-%D8%A7%D8%AD%D8%AA%D8%B1%D8%A7%D9%81%D9%8A-%D9%84%D9%85%D8%A8%D8%A7%D8%AF%D8%B1%D8%A9-%D8%AA%D9%85%D9%83%D9%8A%D9%86-%D8%A5%D9%86%D8%B3%D8%A7%D9%86
648,تطوير نظام حجز مواعيد للخدمات الطبية,Web Development,تطوير الويب,2025-04-30,"3,750.00 ",30.0,6,"تطوير البرمجيات, استكشاف الأخطاء وإصلاحها, برمجة أندرويد, برمجة iOS, كوتلن, تطوير التطبيقات, PHP, برمجة, تطوير قاعدة بيانات","application development ,   , programing android , programing iOS, kotlin, dev apps , PHP, programing, dev",https://mostaql.com/project/1072494-%D8%AA%D8%B7%D9%88%D9%8A%D8%B1-%D9%86%D8%B8%D8%A7%D9%85-%D8%AD%D8%AC%D8%B2-%D9%85%D9%88%D8%A7%D8%B9%D9%8A%D8%AF-%D9%84%D9%84%D8%AE%D8%AF%D9%85%D8%A7%D8%AA-%D8%A7%D9%84%D8%B7%D8%A8%D9%8A%D8%A9
649,تطبيق طوارئ يرسل إشعار وموقع GPS لجهات اتصال محددة iOS و Android,Web Development,تطوير الويب,2025-04-30,900.00 ,60.0,13,"برمجة أندرويد, برمجة التطبيقات, برمجة iOS, جافا, كوتلن, Ionic, Swift, تصميم تطبيقات, تصميم تطبيقات الهواتف الذكية, تصميم UI UX, تصميم واجهة المستخدم, تصميم تجربة المستخدم","programing android , programing  apps , programing iOS, java, kotlin, Ionic, Swift, design  application, design  application mobile, design UI UX, design UI, design UX",https://mostaql.com/project/1072622-%D8%AA%D8%B7%D8%A8%D9%8A%D9%82-%D8%B7%D9%88%D8%A7%D8%B1%D8%A6-%D9%8A%D8%B1%D8%B3%D9%84-%D8%A5%D8%B4%D8%B9%D8%A7%D8%B1-%D9%88%D9%85%D9%88%D9%82%D8%B9-gps-%D9%84%D8%AC%D9%87%D8%A7%D8%AA-%D8%A7%D8%AA%D8%B5%D8%A7%D9%84-%D9%85%D8%AD%D8%AF%D8%AF%D8%A9-ios-%D9%88-android
650,ربط عدادات للمياه والكهرباء إلكترونية بلوحة تحكم وإنشاء فواتير,Web Development,تطوير الويب,2025-04-30,250.00 ,7.0,8,"برمجة مواقع, أمن وحماية المواقع, بايثون, PHP, CSS, جافا سكريبت, تصميم موقع إلكتروني, واجهة برمجة التطبيقات, برمجة iOS, هندسة البرمجيات, اختبار البرمجيات","programing web,   web, python, PHP, CSS, java script, design web ,  programing  apps , programing iOS,programming engineer, testing  programes",https://mostaql.com/project/1046953-%D8%B1%D8%A8%D8%B7-%D8%B9%D8%AF%D8%A7%D8%AF%D8%A7%D8%AA-%D9%84%D9%84%D9%85%D9%8A%D8%A7%D9%87-%D9%88%D8%A7%D9%84%D9%83%D9%87%D8%B1%D8%A8%D8%A7%D8%A1-%D8%A5%D9%84%D9%83%D8%AA%D8%B1%D9%88%D9%86%D9%8A%D8%A9-%D8%A8%D9%84%D9%88%D8%AD%D8%A9-%D8%AA%D8%AD%D9%83%D9%85-%D9%88%D8%A5%D9%86%D8%B4%D8%A7%D8%A1-%D9%81%D9%88%D8%A7%D8%AA%D9%8A%D8%B1
651,بناء تقويم داخل فيجوال بيسك إكسل,Software Engineering,هندسة البرمجيات,2025-04-30,50.00 ,5.0,8,"مايكروسوفت إكسل, تطوير البرمجيات, هندسة البرمجيات, مايكروسوفت أوفيس, إدخال بيانات, برمجة قواعد البيانات, معالجة البيانات, تحليل البيانات, تطوير قاعدة بيانات, كتابة التقارير","Excel,  application development ,programming engineer,  ,  , programing data base,  , data analysis, dev ,",https://mostaql.com/project/1072094-%D8%A8%D9%86%D8%A7%D8%A1-%D8%AA%D9%82%D9%88%D9%8A%D9%85-%D8%AF%D8%A7%D8%AE%D9%84-%D9%81%D9%8A%D8%AC%D9%88%D8%A7%D9%84-%D8%A8%D9%8A%D8%B3%D9%83-%D8%A5%D9%83%D8%B3%D9%84
652,تحسين محركات البحث مع التدقيق في المحتوى ومراجعته طبقا للثقافة السعودية,Web Development,تطوير الويب,2025-04-30,30.00 ,10.0,3,"تصميم موقع إلكتروني, برمجة مواقع, أمن وحماية المواقع, بايثون, PHP, CSS, جافا سكريبت","design web , programing web,   web, python, PHP, CSS, java script",https://mostaql.com/project/1072160-%D8%AA%D8%AD%D8%B3%D9%8A%D9%86-%D9%85%D8%AD%D8%B1%D9%83%D8%A7%D8%AA-%D8%A7%D9%84%D8%A8%D8%AD%D8%AB-%D9%85%D8%B9-%D8%A7%D9%84%D8%AA%D8%AF%D9%82%D9%8A%D9%82-%D9%81%D9%8A-%D8%A7%D9%84%D9%85%D8%AD%D8%AA%D9%88%D9%89-%D9%88%D9%85%D8%B1%D8%A7%D8%AC%D8%B9%D8%AA%D9%87-%D8%B7%D8%A8%D9%82%D8%A7-%D9%84%D9%84%D8%AB%D9%82%D8%A7%D9%81%D8%A9-%D8%A7%D9%84%D8%B3%D8%B9%D9%88%D8%AF%D9%8A%D8%A9
653,موقع ووردبريس مخصص لمطاعم الدايت,Web Development,تطوير الويب,2025-04-30,75.00 ,4.0,16,"برمجة, تصميم موقع إلكتروني, برمجة مواقع, إنشاء موقع إلكتروني, تطوير الويب, تطوير البرمجيات, هندسة البرمجيات","programing, design web , programing web, create web , devweb,  application development ,programming engineer",https://mostaql.com/project/1072184-%D9%85%D9%88%D9%82%D8%B9-%D9%88%D9%88%D8%B1%D8%AF%D8%A8%D8%B1%D9%8A%D8%B3-%D9%85%D8%AE%D8%B5%D8%B5-%D9%84%D9%85%D8%B7%D8%A7%D8%B9%D9%85-%D8%A7%D9%84%D8%AF%D8%A7%D9%8A%D8%AA
654,إدارة موقع عبايات,Web Development,تطوير الويب,2025-04-30,70.00 ,2.0,16,"تطوير الويب, ووردبريس, تطوير البرمجيات, برمجة, برمجة مواقع, إنشاء موقع إلكتروني, إدارة المواقع","devweb, wordpress,  application development , programing, programing web, create web ,  management web",https://mostaql.com/project/1072116-%D8%A5%D8%AF%D8%A7%D8%B1%D8%A9-%D9%85%D9%88%D9%82%D8%B9-%D8%B9%D8%A8%D8%A7%D9%8A%D8%A7%D8%AA
655,تصميم متجر سوبرماركت اون لاين يحتوي على منتجات متنوعة,Web Development,تطوير الويب,2025-04-30,45.00 ,5.0,10,"HTML, CSS, جافا سكريبت, PHP, بايثون, برمجة مواقع, استكشاف الأخطاء وإصلاحها, تطوير البرمجيات, تصميم متجر إلكتروني, إدارة المتاجر الإلكترونية","HTML, CSS, java script, PHP, python, programing web,   ,  application development , design  online market,  management",https://mostaql.com/project/1072346-%D8%AA%D8%B5%D9%85%D9%8A%D9%85-%D9%85%D8%AA%D8%AC%D8%B1-%D8%B3%D9%88%D8%A8%D8%B1%D9%85%D8%A7%D8%B1%D9%83%D8%AA-%D8%A7%D9%88%D9%86-%D9%84%D8%A7%D9%8A%D9%86-%D9%8A%D8%AD%D8%AA%D9%88%D9%8A-%D8%B9%D9%84%D9%89-%D9%85%D9%86%D8%AA%D8%AC%D8%A7%D8%AA-%D9%85%D8%AA%D9%86%D9%88%D8%B9%D8%A9
